Sujeto de Apoyo,Nombre del Proyecto,Sector,Monto Autorizado MXN 
Colegio de Postgraduados,Impacto del Cambio Climático en la Adaptación y Plasticidad Fenotípica del Crecimiento en Árboles Forestales,Agricultura Ganaderia Aprovechamiento Forestal Pesca y Caza,"576,000.00"
Universidad Autónoma de San Luis Potosí,Complejidad Relativa en Sistemas Dinámicos en Red y algunas Aplicaciones,Servicios Educativos,"576,000.00"
Universidad Autónoma del Estado de Hidalgo,Síntesis de Nano-Catalizadores para la Obtención de Biocombustibles a partir de la Hidroconversión Catalítica de Aceite Vegetal Gastado,Servicios Educativos,"576,000.00"
Centro de Investigación y de Estudios Avanzados del Instituto Politécnico Nacional,Mecanismos Celulares y Moleculares de las Funciones Cerebrales en las que Intervienen las Isoformas Cortas de la Distrofina,Servicios Educativos,"576,000.00"
Universidad Nacional Autónoma de México / Coordinación de Investigación Científica / Facultad de Ciencias,Nuevas Tecnologías para la Fabricación de Micro-Ambientes Celulares Biomiméticos,Servicios Educativos,"576,000.00"
Centro de Investigaciones y Estudios Superiores en Antropología Social,"Justicia y Sociedad en México, siglos XVIII a XXI",Servicios Profesionales Científicos y Técnicos,"576,000.00"
"Centro de Investigación Científica de Yucatán, AC","Valoración de los Recursos Vegetales, Naturales y Renovables de la Península de Yucatán",Servicios Profesionales Científicos y Técnicos,"576,000.00"
Universidad Autónoma del Estado de Morelos ,Catalizadores Híbridos Obtenidos por Trasplante Denso y Orientado de Enzimas en la Superficie de Materiales,Servicios Educativos,"576,000.00"
"Centro de Investigaciones en Óptica, AC",Cromóforos Carbomeros para la Absorción de dos Fotones,Servicios Profesionales Científicos y Técnicos,"576,000.00"
Casa Universitaria Franco Mexicana,6° Simposio Becarios CONACYT en Europa 2017,No disponible,"1,150,000.00"
Durham University Mexican Society (DUMexSoc),XV Simposio de Estudios y Estudiantes Mexicanos en el Reino Unido,No disponible,"150,000.00"
Universidad Nacional Autónoma de México / Coordinación de Investigación Científica,Oceanic Exchanges: Tracing Global Information Networks in Historical Newspaper Repositories,Servicios Educativos,"2,730,000.00"
Instituto Nacional de Antropología e Historia,Explorando el México Colonial Temprano: Análisis computacional a gran escala de fuentes históricas del siglo XVI,Actividades del Gobierno y de Organismos Internacionales y Extraterritoriales,"3,274,000.00"
International Institute for Applied Systems Analysis ,Estancias posdoctorales,No disponible,"3,750,000.00"
Guillermo Jesús Larios Hernández,Convocatoria para instructores de Nodos Binacionales de Innovación,No disponible,"167,000.00"
Rosa Patricia Rubio Solorio,Propuesta para ser instructor del NoBI,No disponible,"167,000.00"
Luis Alfonso Quero Rodríguez,Propuesta para participar en la Convocatoria para Formación de Instructores de la curricula I-Corps reconocidos por CONACYT y la NSF,No disponible,"167,000.00"
Marcus Dantus Mochan,Marcus Dantus Mochan,No disponible,"167,000.00"
Banff International Research Station,Actividades científicas correspondientes al año 2017 ,No disponible,"850,000.00"
European Organization for Nuclear Research (CERN),Actividades del experimento CMS correspondientes al año 2017,No disponible,"3,288,076.00"
"El Colegio de México, AC","El Colegio Internacional de Graduados: Entre Espacios. Movimientos, Actores y Representaciones de la Globalización",Servicios Educativos,"701,000.00"
Asociación Nacional de Universidades e Instituciones de Educación Superior de la República Mexicana AC (ANUIES)  ,Participación y organización del pabellón México en la feria NAFSA 2017,Servicios Educativos,"300,000.00"
"Centro de Investigación en Química Aplicada, AC",Manufactura Avanzada de Caucho en Solución Mediante un Proceso en Continuo,"Industria Manufacturera de Madera, Papel, Derivados del Petróleo e Industria Química","3,035,646.00"
European Organization for Nuclear Research (CERN),Contribución de México para el desarrollo de las actividades del experimento ALICE correspondientes al año 2017,No disponible,"3,390,574.00"
European Organization for Nuclear Research (CERN),Contribución de México para el desarrollo de las actividades del proyecto BEAM correspondiente al año 2017 ,No disponible,"1,980,000.00"
European Organization for Nuclear Research (CERN),Contribución de México para el desarrollo de las actividades del experimento NA62 correspondientes al año 2017,No disponible,"220,000.00"
European Organization for Nuclear Research (CERN),Aportación anual de México para el desarrollo de las actividades del experimento AMS-02 correspondiente al año 2017,No disponible,"132,628.54"
Jonathan Arriaga González,Jonathan Arriaga González,Becario,"900,000.00"
Mónica Terán Hernández,Mónica Terán Hernández,Becario,"900,000.00"
Afaf Abdelrahman Mohamed Ahmed Elshereef,Afaf Abdelrahman Mohamed Ahmed Elshereef,Becario,"500,000.00"
Centro de Investigación y de Estudios Avanzados del Instituto Politécnico Nacional / Unidad Irapuato,Decifrando el papel de los compuestos orgánicos volátiles en la inducción de la resistencia a la sequía y las enfermedades en frijol común (Phaesolus vulgaris): desde la genómica hasta el campo,Servicios Educativos,"2,210,000.00"
Universidad Autónoma de la Ciudad de México,Fotoacústica para el estudio de nanoestructuras y de sus procesos de formación,Servicios Educativos,"2,210,000.00"
Universidad Nacional Autónoma de México / Coordinación de Investigación Científica / Instituto de Ciencias del Mar y Limnología,Corales hermatípicos como archivos naturales de cambios climáticos en el Caribe Mexicano,Servicios Educativos,"2,600,000.00"
Mitacs Inc,Primer año a Mitacs Inc,No disponible,"5,100,000.00"
Israel Loera Carrizales,Estancias posdoctorales,Becario,"900,000.00"
Luis Martín Mejía Mendoza,Estancias posdoctorales,Becario,"900,000.00"
Flavia Termignoni García,Estancias posdoctorales,Becario,"900,000.00"
Universidad Nacional Autónoma de México / Coordinación de Investigación Científica / Instituto de Ecología,Projecting the Influences of Political Incentives on Urban Land Conversion and Hydrologic Consequences in the Mexico City Metropolitan Area,Servicios Educativos,"66,000.00"
European Organization for Nuclear Research (CERN),Contribución de México para la construcción del Readout & Trigger System del Upgrade del ALICE Detector,No disponible,"3,900,000.00"
"Instituto de Ecología, AC","Anthropogenic Mediation of Soil-Landform Relationships: Disturbance and Recovery Along a Climatic Gradient in Central Veracruz, Mexico",Servicios Profesionales Científicos y Técnicos,"88,000.00"
"Centro de Investigaciones en Óptica, AC",Absorción óptica no lineal en nuevos materiales orgánicos: el caso de cromóforos carbomeros,Servicios Profesionales Científicos y Técnicos,"520,000.00"
Universidad de Columbia,Programa Edmundo OGorman 2017,No disponible,"1,000,000.00"
Universidad de California,Programa de Investigación en Migración y Salud (PIMSA) 2017,No disponible,"1,000,000.00"
Universidad de Texas A&M,Programa Conjunto de Proyectos de Colaboración 2017,No disponible,"4,000,000.00"
Karlsruher Institut für Technologie,Actividades del Observatorio Pierre Auger correspondiente al año 2016,No disponible,"2,091,113.00"
"Centro de Investigación y Docencia Económicas, AC",Examining Ilicit Drug Flows,Servicios Profesionales Científicos y Técnicos,"99,000.00"
Instituto Nacional de Antropología e Historia,Investigation of human skeletal remains of prehistoric Baja California Peninsula and inferences for modeling island evolution on mainland,Actividades del Gobierno y de Organismos Internacionales y Extraterritoriales,"132,000.00"
Instituto Interamericano de Cooperación para la Agricultura Oficina en Costa Rica (IICA),9ª. Feria Mexicana de Posgrados de Calidad 2017,No disponible,"500,000.00"
Universidad de California,Programa UC MEXUS-CONACYT para Proyectos de Investigación (Grants),No disponible,"10,219,740.00"
European Organization for Nuclear Research (CERN),Aportación al SCOAP3 correspondiente al año 2017,No disponible,"1,012,000.00"
Universidad de California,Programa UC MEXUS-CONACYT para Estancias Posdoctorales correspondiente al año 2017,No disponible,"11,700,140.00"
Universidad Nacional Autónoma de México / Coordinación de Investigación Científica / Instituto de Matemáticas,Laboratorio Lefschetz (LaSoL) 2017,Servicios Educativos,"1,324,000.00"
Karlsruher Institut für Technologie,Observatorio Pierre Auger correspondiente al año 2017,No disponible,"1,926,424.80"
Universidad de Sussex,Colaboración conjunta entre el CONACYT y la Universidad de Sussex ,No disponible,"910,000.00"
Max Planck Institut für Pflanzenzüchtungsforschung,The mechanistic basis for heterochrony dependent natural variation in leaf shape,No disponible,"609,500.00"
Max Planck Institut für ethnologische Forschung,"Power, Conflict and Integration: Mexican Women in Mixed Marriages in Berlin",No disponible,"609,500.00"
Instituto Tecnológico Autónomo de México,The First Mexico/USA Logic Fest,Servicios Profesionales Científicos y Técnicos,"60,000.00"
Universidad de Texas en San Antonio (UTSA) ,Programa de Investigación Colaborativa 2018,No disponible,"10,000,000.00"
Instituto Tecnológico Superior de los Ríos,"Desarrollo, evaluación en campo y análisis de factibilidad comercial de dos cultivos del Sureste Mexicano con Denominación de Origen, editados genómicamente para conferirles resistencia contra patógenos fúngicos y oomicetos",Servicios Educativos,"5,209,281.00"
Instituto Interamericano de Cooperación para la Agricultura,Desarrollo de las actividades de comunicación y divulgación en materia de Bioseguridad.,No disponible,"1,600,000.00"
"Comayeles, S.A. de C.V.","Contexto socioeconómico, impactos potenciales y estrategia para la consulta a comunidades indígenas, de la producción de soya modificada genéticamente en Yucatán",Servicios Profesionales Cientificos Y Tecnicos,"905,000.00"
