Sujeto de Apoyo,Nombre del Proyecto,Sector,Monto Autorizado MXN 
Universidad Autónoma de Baja California,"DESARROLLO DE UN MÉTODO MULTIPLEX, ECONÓMICO Y RÁPIDO PARA LA IDENTIFICACIÓN SIMULTÁNEA DE MUTACIONES RESPONSABLES DE LA RESISTENCIA A DROGAS ANTI-TUBERCULOSAS DE PRIMERA Y SEGUNDA LÍNEA, APLICADO DIRECTAMENTE EN MUESTRAS CLÍNICAS",Servicios Educativos,"1,993,351.00"
Universidad de Occidente,DESARROLLO DE UN SISTEMA DE APOYO PARA LA TOMA DE DECISIONES BASADO EN AGENTES INTELIGENTES PARA EL DISEÑO DE NUEVOS PRODUCTOS AGROINDUSTRIALES,Servicios Educativos,"1,101,000.00"
Universidad Nacional Autónoma de México - Instituto de Geofísica,DISEÑO DE UNA ESTRATEGIA NACIONAL ANTE FENOMENOS DE CLIMA ESPACIAL,Servicios Educativos,"3,640,000.00"
Centro de Investigación Científica de Yucatán A.C. (CICY),Generación de una Variedad Intragénica de Plátano Resistente a la Enfermedad de la Sigatoka Negra para Mejorar la Economía de los Productores y Proteger al Ambiente.,"Servicios Profesionales, Cientificos Y Tecnicos","2,000,000.00"
Universidad Nacional Autónoma de México - Facultad de Medicina Veterinaria y Zootecnia,EVALUACIÓN DE UN TRATAMIENTO NOVEDOSO PARA INFECCIONES POR LEPTOSPIRA EN ANIMALES DE COMPAÑIA Y PRODUCCIÓN,Servicios Educativos,"2,000,000.00"
Universidad Nacional Autónoma de México - Facultad de Ciencias,"HONGOS MEXICANOS: FILOGENIA Y BIOGEOGRAFÍA APLICADAS A LA VALORACIÓN Y CONSERVACIÓN DE ESPECIES MEXICANAS ENDÉMICAS, CON ÉNFASIS EN AQUELLAS DISTRIBUIDAS EN BOSQUES TEMPLADOS HÚMEDOS DE MONTAÑA",Servicios Educativos,"3,150,000.00"
Universidad Nacional Autónoma de México - Instituto de Ecología,"ESTRATEGIA DE REHABILITACIÓN ECOLÓGICA EMPLEANDO BIODIVERSIDAD NATIVA, EN BOSQUE TEMPLADO AFECTADO POR ACTIVIDAD MINERA PÉTREA Y AGROPECUARIA",Servicios Educativos,"3,962,830.00"
Universidad Autónoma del Estado de Hidalgo,PROCESAMIENTO DE ARCILLAS FELDESPÁTICAS PARA LA GENERACIÓN DE EMPLEOS Y LA PRODUCCIÓN DE ALIMENTOS,Servicios Educativos,"2,000,000.00"
Universidad Nacional Autónoma de México - Centro Regional de Investigaciones Multidisciplinarias,VIOLENCIA CONTRA MUJERES Y SEGURIDAD CIUDADANA EN MÉXICO. UN ACERCAMIENTO DESDE EL ÁMBITO MUNICIPAL PARA LA FORMULACIÓN E IMPLEMENTACIÓN DE POLÍTICAS,Servicios Educativos,"4,000,000.00"
Centro de Investigación y Asistencia en Tecnología y Diseño del Estado de Jalisco A.C. (CIATEJ),EFECTOS HEMATOPOYÉTICOS EN NIÑOS EXPUESTOS AMBIENTALMENTE A BENCENO,"Servicios Profesionales, Cientificos Y Tecnicos","1,128,000.00"
Universidad Nacional Autónoma de México - Instituto de Geofísica,"ELABORACION DEL MAPA DE PELIGROS DEL VOLCAN TACANA, CHIAPAS Y ANALISIS PARA LA PREVENCION DE RIESGOS",Servicios Educativos,"1,999,000.00"
Universidad Autónoma de Baja California,HERRAMIENTAS MOLECULARES Y MORFOLÓGICAS PARA LA CARACTERIZACIÓN DE TRYPANOSOMA CRUZI Y SU VECTOR ENDÉMICO DIPETALOGASTER MAXIMUS EN LA PENÍNSULA DE BAJA CALIFORNIA,Servicios Educativos,"1,500,000.00"
Universidad Autónoma Metropolitana - Unidad Iztapalapa,APLICACIÓN DE UN MODELO BIOPSICOSOCIAL PARA EL BIENESTAR FAMILIAR. DISMINUCIÓN DE FACTORES ESTRESANTES Y CONDUCTAS AGRESIVAS DURANTE LA CONVIVENCIA COTIDIANA,Servicios Educativos,"1,500,000.00"
Universidad Nacional Autónoma de México - Instituto de Geofísica,TRANSFERENCIA DE ESFUERZOS SÍSMICOS Y EFECTOS SOBRE LA SISMICIDAD EN LA ZONA DE SUBDUCCIÓN MEXICANA,Servicios Educativos,"1,885,276.00"
Universidad Nacional Autónoma de México - Instituto de Ecología,"DESARROLLO, OPTIMIZACIÓN E IMPLEMENTACIÓN DE NUEVAS TECNOLOGÍAS MOLECULARES Y CARTOGRÁFICAS DE BIOMONITOREO DE TRANSGENES Y HERBICIDAS EN MAÍZ EN MÉXICO: HACIA UNA ESTRATEGIA Y PANORAMA INTEGRALES DE BIOSEGURIDAD",Servicios Educativos,"4,000,000.00"
Instituto Tecnológico y de Estudios Superiores de Monterrey,ALGORITMOS BASADOS EN MINUCIAS PARA LA IDENTIFICACIÓN DE HUELLAS LATENTES DACTILARES Y PALMARES,Servicios Educativos,"1,970,383.00"
Universidad Autónoma de Chapingo,"EL PROYECTO ESTRATÉGICO DE SEGURIDAD ALIMENTARIA, LA CRUZADA CONTRA EL HAMBRE Y LAS SINERGIAS PARA POTENCIARLAS",Servicios Educativos,"3,839,802.00"
Instituto Politécnico Nacional,"DISEÑO POR COMPUTADORA, SÍNTESIS Y EVALUACIÓN EXPERIMENTAL DE COMPUESTOS CON ACTIVIDAD MULTI-TARGET CONTRA EL CÁNCER DE MAMA TRIPLE NEGATIVO",Servicios Educativos,"3,980,000.00"
Instituto Tecnológico y de Estudios Superiores de Monterrey,DESARROLLO DE NUEVAS TECNOLOGÍAS DE NEUROREHABILITACIÓN PARA ABORDAR EL PROBLEMA DE DISCAPACIDAD MOTORA EN MÉXICO,Servicios Educativos,"1,500,000.00"
El Colegio de Sonora,LA CAPACIDAD INSTITUCIONAL DE LOS ORGANISMOS OPERADORES DE AGUA POTABLE DE LAS REGIONES NORTE Y BAJÍO DE MÉXICO,Servicios Educativos,"894,910.00"
Instituto Nacional de Medicina Genómica,VARIANTES GENÓMICAS PARA IDENTIFICAR TUBERCULOSIS FÁRMACORRESISTENTE DIRECTAMENTE EN MUESTRA CLÍNICA,"Servicios Profesionales, Cientificos Y Tecnicos","1,353,000.00"
Instituto Politécnico Nacional,SISTEMA MOVIL GEO-SOCIAL DE RUTAS SEGURAS Y PRONOSTICO DELICTIVO PARA LA CIUDAD DE MEXICO,Servicios Educativos,"1,400,000.00"
Instituto Tecnológico y de Estudios Superiores de Monterrey,DESARROLLO DE UNA METODOLOGÍA URBANO-AMBIENTAL PARA ESTIMAR LOS IMPACTOS EN LA SALUD PÚBLICA DE LAS EMISIONES VEHICULARES EN CIUDADES MEDIAS CON CRECIMIENTO VEHICULAR Y POBLACIONAL ACELERADOS,Servicios Educativos,"2,590,748.00"
Instituto Nacional de Investigaciones Forestales Agrícolas y Pecuarias,"GENERACION DE TECNOLOGÍA PARA LA PRODUCCIÓN SUSTENTABLE Y USO INTEGRAL DE MALANGA Y YUCA EN TABASCO Y VERACRUZ, MÉXICO",AGRICULTURA GANADERIA APROVECHAMIENTO FORESTAL PESCA Y CAZA,"2,710,000.00"
Instituto Politécnico Nacional,POTENCIAL DE BACOPA MONNERI PENELL COMO ALTERNATIVA SUSTENTABLE PARA DESALINIZAR Y MEJORAR LA CALIDAD EDÁFICA DE SUELOS SALINOS,Servicios Educativos,"1,500,000.00"
Instituto Politécnico Nacional,"DESARROLLO DE UN PLAN PILOTO PARA EL MEJORAMIENTO DE LA RESILIENCIA DE UNA REGIÓN VULNERABLE A SISMOS Y/O INUNDACIONES, REPRESENTATIVA DE GRANDES CONCENTRACIONES URBANAS DE LA REPÚBLICA MEXICANA",Servicios Educativos,"2,000,000.00"
Instituto Mexicano de Tecnología del Agua,OPTIMIZACIÓN DE LOS PROCESOS DE TRATAMIENTO DE RESIDUOS PROVENIENTES DE LA REMOCIÓN DE ARSÉNICO EN AGUA PARA CONSUMO HUMANO,"Servicios Profesionales, Cientificos Y Tecnicos","1,937,000.00"
Instituto Educativo del Noroeste A.C.,"FACTORES QUE INCIDEN EN LA COMPETITIVIDAD DE UNA INDUSTRIA CULTURAL Y CREATIVA: EL CASO DE LA CERVEZA ARTESANAL DE BAJA CALIFORNIA, MÉXICO",Servicios Educativos,"514,297.00"
Universidad Autónoma del Estado de Hidalgo,PROPUESTA DE UN MODELO DE INNOVACIÓN BASADO EN LA ECONOMIA NACIONAL DEL CONOCIMIENTO,Servicios Educativos,"4,000,000.00"
Instituto Tecnológico Superior de Tierra Blanca,CELDAS DE COMBUSTIBLE MICROBIANAS PARA LA GENERACIÓN DE ENERGÍA ELÉCTRICA A PARTIR DE AGUAS RESIDUALES ACUÍCOLAS DEL ESTADO DE VERACRUZ,Servicios Educativos,"1,500,000.00"
Instituto Politécnico Nacional,PELÍCULAS DELGADAS DE ÓXIDOS NANOESTRUCTURADOS PARA DISMINUIR LA TEMPERATURA DE OPERACIÓN DE CELDAS DE COMBUSTIBLE,Servicios Educativos,"2,000,000.00"
Centro de Investigación y Asistencia en Tecnología y Diseño del Estado de Jalisco A.C. (CIATEJ),NANOESTRUCTURAS AUTOENSAMBLADAS A BASE DE BIOPOLÍMEROS NATURALES Y SU EVALUACIÓN ESTABILIZANTE DE HIERRO PARA ATENDER LA DESNUTRICIÓN INFANTIL,"Servicios Profesionales, Cientificos Y Tecnicos","1,200,000.00"
Instituto Nacional de Salud Pública,"EVALUACIÓN DE
REPELENTES ESPACIALES Y SUS SISTEMAS DE LIBERACIÓN PARA EL MANTENIMIENTO DE ÁREAS LIBRES DE MOSQUITOS VECTORES DE DENGUE, FIEBRE CHIKUNGUNYA Y ZIKA EN MÉXICO","Servicios Profesionales, Cientificos Y Tecnicos","2,000,000.00"
Universidad Autónoma de Baja California,DESARROLLO DE UN SISTEMA DE DETECCIÓN DE RICKETTSIA RICKETTSII BASADO EN APTÁMEROS DE ARN,Servicios Educativos,"1,500,000.00"
Centro de Investigación y Asistencia en Tecnología y Diseño del Estado de Jalisco A.C. (CIATEJ),SISTEMA PARA LA INTELIGENCIA TERRITORIAL TECNOLÓGICA Y COMPETITIVA DE LOS ALIMENTOS Y LA ALIMENTACIÓN (SITTC DE LOS ALIMENTOS Y LA ALIMENTACIÓN),"Servicios Profesionales, Cientificos Y Tecnicos","3,876,228.00"
Instituto Politécnico Nacional,"POLÍTICAS PÚBLICAS
PARA ENFRENTAR LA POBREZA EXTREMA MEDIANTE LA DISMINUCIÓN DE PÉRDIDAS DE ALIMENTOS EN MÉXICO",Servicios Educativos,"2,000,000.00"
Universidad del Papaloapan,MOLIENDA MECÁNICA DE ALTA ENERGÍA PARA LA OBTENCIÓN DE AZÚCARES REDUCTORES DE FUENTES NO CONVENCIONALES PARA LA PRODUCCIÓN DE BIOHIDRÓGENO POR FERMENTACIÓN OSCURA,Servicios Educativos,"1,500,000.00"
Universidad Autónoma de Baja California,"MODELO INTEGRAL DE COMBATE A LA POBREZA E INSEGURIDAD ALIMENTARIA PARA COMUNIDADES EN SITUACIÓN DE VULNERABILIDAD DE TIJUANA, BAJA CALIFORNIA",Servicios Educativos,"3,901,000.00"
Instituto Politécnico Nacional,VALORACIÓN DE LA CONDICIÓN DE SALUD DE CUERPOS DE AGUA EN ÁREAS NATURALES PROTEGIDAS A TRAVÉS DEL MONITOREO BIOLÓGICO CON FINES DE CONSERVACIÓN Y GESTIÓN DEL RECURSO HÍDRICO,Servicios Educativos,"2,000,000.00"
Instituto Nacional de Ciencias Médicas y Nutrición Salvador Zubiran,Progama de becas,Servicios Educativos,"7,000,000.00"
Universidad Autónoma de la Ciudad de México,"La Migración irregular en Tránsito por México: Marco Institucional, Gestión Organizacional y Prácticas Migratorias.",Servicios Educativos,"349,202.00"
Centro de Investigación Científica de Yucatán A.C. (CICY),"Diseño, Construcción e Implementación de un Vehículo Submarino Autónomo Alimentado Por Energías Renovables, Para La Localización, Cuantificación Y Monitoreo Del Pez León, Especie Invasora En El Caribe","Servicios Profesionales, Cientificos Y Tecnicos","3,880,000.00"
Instituto de Ecología A.C. (INECOL),Comunicacion Quimica Planta-Bacteria Y Su Impacto En La Producción Agrícola,"Servicios Profesionales, Cientificos Y Tecnicos","1,500,000.00"
Instituto Nacional de Salud Pública,"Epidemiología Molecular, Farmacorresistencia Y Susceptibilidad Genética De La Tuberculosis En La Zona Huichol En Jalisco, México","Servicios Profesionales, Cientificos Y Tecnicos","3,999,790.00"
Universidad Autónoma del Estado de Morelos,"Conflictos Entre Conservación De La Vida Silvestre Y Las Comunidades Rurales De La Reserva De La Biósfera Sierra De Huautla, Morelos.",Servicios Educativos,"608,800.00"
Universidad Autónoma de Yucatán,Estudio Y Diagnóstico De La Infección Experimental Con Trypanosoma Cruzi Mediante La Aplicación De Técnicas Innovadoras No Invasivas Basadas En Ultrasonido.,Servicios Educativos,"3,992,000.00"
Universidad Autónoma de Chihuahua,Utilizacion Del Ultrasonido De Potencia Como Tecnología Emergente Para Atender Problemas De Calidad De La Carne,Servicios Educativos,"4,000,000.00"
Colegio de Postgraduados,Análisis Transcriptómico De La Microbiota Ruminal De Bovinos Alimentados Con Forrajes Tropicales Y Su Correlación Con La Producción De Gases De Efecto Invernadero,"Servicios Profesionales, Cientificos Y Tecnicos","1,011,000.00"
Universidad Autónoma del Estado de Morelos,Preparación De Nuevos Agentes Antitumorales Más Selectivos A Través De Procesos Sostenibles.,Servicios Educativos,"945,000.00"
Instituto Mexicano de Tecnología del Agua,Desalinización De Agua Subterránea Salobre Mediante Energía Solar Para Aplicaciones De Riego Agrícola En Zonas Rurales,"Servicios Profesionales, Cientificos Y Tecnicos","1,190,000.00"
Centro de Investigaciones Biológicas del Noreste S.C. (CIBNOR),Desarrollo Y Validación De Alimentos Funcionales Para El Control De Enfermedades En El Camarón Litopenaeus Vannamei,"Servicios Profesionales, Cientificos Y Tecnicos","1,104,000.00"
Centro de Investigación y Asistencia en Tecnología y Diseño del Estado de Jalisco A.C. (CIATEJ),"Producción Y Aprovechamiento Del Café. Prospección Sistémica De La Cadena De Valor En Los Estados De Chiapas, Oaxaca Y Guerrero.","Servicios Profesionales, Cientificos Y Tecnicos","1,205,000.00"
Centro de Investigación en Materiales Avanzados S.C. (CIMAV),Establecimiento De Estrategias Pasivas Selectivas En Vivienda De Interés Social Para Ciudades Con Clima Templado Seco,Ninguna,"767,000.00"
Centro de Investigación y Asistencia en Tecnología y Diseño del Estado de Jalisco A.C. (CIATEJ),"Protección, Sustentabilidad Y Aprovechamiento Del Ecosistema En La Biodiversidad Del Agave: La Cadena Productiva Del Mezcal En Los Estados De Guerrero Y Oaxaca","Servicios Profesionales, Cientificos Y Tecnicos","1,500,000.00"
Instituto Nacional de Cardiología Ignacio Chávez,Evaluación Del Control Cardiovascular Empleando Análisis Tiempo-Frecuencia Del Intervalo Inter Latidos Y De La Tensión Arterial Para La Detección Temprana De Los Periodos De Hipotensión En Pacientes Con Insuficiencia Renal Crónica,Servicios De Salud Y De Asistencia Social,"1,367,280.00"
Universidad del Mar,"Evaluación Del Potencial De Las Técnicas De Secuenciación Masiva, Adn Ambiental Y Código De Barras Genético Para La Descripción De La Biodiversidad Bentónica De Los Ecosistemas Marinos Y Costeros De Oaxaca",Servicios Educativos,"1,252,000.00"
Centro de Investigaciones en Óptica A.C. (CIO),Diseño Y Construcción De Potabilizador Integral Solar De Agua Para Comunidades Rurales,"Servicios Profesionales, Cientificos Y Tecnicos","3,979,347.00"
Centro de Investigación y Docencia Económicas A.C. (CIDE),Entendiendo Y Resolviendo Conflictos Por El Agua En México: Elementos De Gobernanza Y Propuestas De Política Pública,Servicios Educativos,"4,000,000.00"
Centro de Investigaciones Biológicas del Noreste S.C. (CIBNOR),"Un Nuevo Enfoque Para La Recuperación, Inspección Y Vigilancia De Recursos Sobreexplotados De Alto Valor Comercial, Caso De Estudio: La Pesquería De Abulón","Servicios Profesionales, Cientificos Y Tecnicos","1,499,400.00"
Universidad Autónoma de Chihuahua,Desarrollo De Tecnología Innovadora En La Disposición De Residuo Plástico,Servicios Educativos,"1,500,000.00"
Instituto Tecnológico de Tijuana,Biomateriales Producidos a partir de Polímeros Naturales para Tratamiento Regenerativo de Úlceras del Pie Diabético.,Servicios Educativos,"2,000,000.00"
Instituto Tecnológico de Tijuana,Aplicación y Desarrollo de Materiales Nanoestructurados para el Aprovechamiento de la Energia Solar Mediante la Generación de Celdas Solares de Baja Potencia Sensibilizadas con Colorantes Orgánicos y Organometálicos,Servicios Educativos,"1,500,000.00"
Universidad Nacional Autónoma de México - Centro de Geociencias,Monitoreo de la Sismicidad Relaciona con la Actividad del Volcán Ceborucocolorantes Orgánicos y Organometálicos,Servicios Educativos,"1,500,000.00"
El Colegio de la Frontera Norte A.C. (COLEF),Espacios Públicos y Actividad Física en Ciudades del Norte de México,Servicios Educativos,"2,224,790.00"
Universidad Juárez Autónoma de Tabasco,Planta Solar Prototipo para la Producción Fotoasistida de Hidrógeno Empleando Nanoestructuras Modificadas de WO3 Soportadas en Carbono,Servicios Educativos,"1,500,000.00"
Universidad de Colima,Ingeniería de Plantas: Diseño de Plantas Resistentes a los Begomovirus de Mayor Importancia en México Basado en Micrornas.,Servicios Educativos,"1,500,000.00"
El Colegio de México A.C.,La Competitividad de las Ciudades en el Desarrollo de México,"Servicios Profesionales, Cientificos Y Tecnicos","1,482,000.00"
Universidad Iberoamericana A.C.,Pobreza Urbana: una Nueva Visión Multidimensional,Servicios Educativos,"3,340,000.00"
Universidad Autónoma de Chapingo,Prototipos Regionales para la Seguridad y la Soberania Alimentaria y el Combate a la Pobreza. un Enfoque Territorial.,Servicios Educativos,"3,874,000.00"
Instituto Tecnológico de Sonora,Optimización de Sinergias entre Celdas Solares Fotovoltaicas y Membranas de Ósmosis Inversa para la Desalinización de Aguas Marinas y Salobres,"Servicios Profesionales, Cientificos Y Tecnicos","1,497,612.00"
Centro de Investigación Científica y de Educación Superior de Ensenada B.C. (CICESE),Desarrollo e Implementación de Captadores de Niebla Bioinspirados en la Península de Baja California.,Servicios Educativos,"1,427,000.00"
Universidad Michoacana de San Nicolás de Hidalgo,Crimen Organizado y Debilidad Institucional en Michoacàn.,Servicios Educativos,"340,000.00"
Universidad Autónoma de Chihuahua,Utilización de Zeolitas Naturales Mexicanas para la Remoción de Contaminantes en Agua.,Servicios Educativos,"3,545,000.00"
Instituto Tecnológico de Tizimín,Estudio Multidisciplinario para el Uso Sustentable de Limulus Polyphemus en la Península de Yucatán.,"Servicios Profesionales, Cientificos Y Tecnicos","3,749,000.00"
Universidad Michoacana de San Nicolás de Hidalgo,Genética del Paisaje y Estructura Genética de Vertebrados Endémicos del Bosque Tropical Caducifolio: Implicaciones para su Conservación.,Servicios Educativos,"1,500,000.00"
Instituto Tecnológico de Chetumal,Evaluación del Efecto de la Forma Urbana sobre el Consumo de Recursos y sus Impactos Ambientales y Económicos.,Servicios Educativos,"1,090,000.00"
Universidad Michoacana de San Nicolás de Hidalgo,Aprovechamiento  de  Pozos  Petroleros Abandonados/Inoperantes como Fuente Sustentable de Energía para Sistemas Híbridos Geotermia/Concentrador Solar,Servicios Educativos,"1,500,000.00"
Instituto Tecnológico de Tepic,Aplicación de Recubrimientos Adicionados de Agentes de Biocontrol a Frutos Tropicales para el Control de Enfermedades Postcosecha.,Servicios Educativos,"1,960,000.00"
Instituto Politécnico Nacional,"Alimentos y Productos de Maíz y Frijol Pigmentados con Alto Valor 
Nutricionl para Comunidades Oaxaqueñade Alta Marginación.",Servicios Educativos,"3,656,688.00"
Universidad Michoacana de San Nicolás de Hidalgo,Desarrollo Local y Seguridad Alimentaria a Través del Metabolismo Social de Productos Básicos Agroalimentarios y Pesqueros en Michoacán.,Servicios Educativos,"1,430,000.00"
Instituto Nacional de Cancerología,"Efectos De Una Intervención Cognitivo Conductual Sobre La Adhesión Al Tratamiento, Tabaquismo Y Calidad De Vida, Mediante la Modificación de los Estilos de Afrontamiento en Pacientes con Cáncer de Mama en Inicio de Tratamiento Médico.",Servicios De Salud Y De Asistencia Social,"278,000.00"
Universidad Autónoma de Nuevo León,Generación de Hidrogeno como Fuente de Energía Alterna.,Servicios Educativos,"1,500,000.00"
Universidad de Guadalajara,Identificación Molecular e Historia Demográfica de Encinares de México: Herramientas para su Manejo y Conservación.,Servicios Educativos,"1,310,000.00"
Thomson Reuters (Scientific) LLC,"Derechos de Acceso a los Articulos, Titulos y Publicaciones Electronicas.",No disponible,"67,551,267.77"
Centro de Investigaciones y Estudios Superiores en Antropología Social (CIESAS),"Caracterización de la Vulnerabilidad en Pueblos y Comunidades Indígenas: Caso de Estudio con Pescadores Cucapá En Baja California.","Servicios Profesionales, Cientificos Y Tecnicos","1,146,000.00"
Universidad Nacional Autónoma de México - Centro de Ciencias de la Atmósfera,Repositorio Institucional del Centro de Ciencias de la Atmósfera de la UNAM.,Servicios Educativos,"1,000,000.00"
Universidad Nacional Autónoma de México - Centro de Ciencias Genómicas,Repositorio de Conocimiento Genómico,Servicios Educativos,"975,740.96"
Universidad Nacional Autónoma de México - Instituto de Fisiología Celular,Mejoramiento e Implementación de una Base de Datos de Modificaciones Postraduccionales de la Levadura Saccharomyces Cerevisiae.,Servicios Educativos,"277,192.00"
Universidad Nacional Autónoma de México - Facultad de Ciencias,"Desarrollo del Portal de Acceso a la Información Biológica de la Unidad de Informática para la Biodiversidad de la Facultad de Ciencias, UNAM.",Servicios Educativos,"634,920.00"
Universidad Nacional Autónoma de México - Facultad de Estudios Superiores Iztacala,Implantación del Repositorio Institucionales de Acceso Abierto a la Información Científica y de Innovación Educativa en la Facultad de Estudios Superiores Iztacala,Servicios Educativos,"370,000.00"
Universidad Nacional Autónoma de México - Facultad de Ciencias,Creación de un Repositorio Público de Información de Cenotes del Estado de Yucatán.,Servicios Educativos,"467,000.00"
Universidad Nacional Autónoma de México - Instituto de Investigaciones en Matemáticas Aplicadas y en Sistemas,"Repositorio Institucional del Instituto de Investigaciones en Matemáticas Aplicadas y en Sistemas (IIMAS), UNAM.",Servicios Educativos,"741,825.00"
Universidad Nacional Autónoma de México - Dirección General de Cómputo y de Tecnologías de Información y Comunicación y Dirección General de Bibliotecas,"Repositorio Universitario de la Dirección General de Cómputo y de Tecnologías de Información y Comunicación, RU-TIC.",Servicios Educativos,"600,000.00"
"Universidad Nacional Autónoma de México - Escuela Nacional de Estudios Superiores, Unidad Morelia",Propuesta para el Desarrollo de una Infraestructura Tecnológica para la Creación de Repositorios Masivos de Datos Biológicos con Fines de Conservación y Análisis de Información.,Servicios Educativos,"1,000,000.00"
Universidad Nacional Autónoma de México - Instituto de Investigaciones en Ecosistemas y Sustentabilidad,Bases para Mejorar el Aprovechamiento Sustentable del Agua de Uso Agrícola en México.,Servicios Educativos,"1,078,000.00"
Instituto Mexicano del Seguro Social - Fondo de Investigación en Salud,Proteínas Reguladoras de la Vía de Wnt como Biomarcadores para el Diagnóstico de la Artritis Reumatoide.,Servicios De Salud Y De Asistencia Social,"1,493,500.00"
Universidad Nacional Autónoma de México - Instituto de Geofísica,El Repositorio Institucional de Clima Espacial México.,Servicios Educativos,"968,000.00"
Universidad Nacional Autónoma de México - Instituto de Geofísica,Repositorio de Datos del Servicio Sismológico Nacional.,Servicios Educativos,"993,000.00"
"El Colegio Mexiquense, A.C.","Proyecto para la Renovación de la Política Editorial de la Revista Economía, Sociedad Y Territorio y la Mejora de su Posicionamiento en Sistemas de Información.","Servicios Profesionales, Cientificos Y Tecnicos","109,864.32"
Universidad Autónoma Metropolitana - Unidad Iztapalapa,"Edición, Difusión y Ubicación a Nivel Internacional de la Revista Alteridades.",Servicios Educativos,"107,812.72"
El Colegio de la Frontera Norte A.C. (COLEF),"Consolidación de la Política Editorial, Optimización de la Visibilidad y Posicionamiento Web de la Revista Migraciones Internacionales.",Servicios Educativos,"129,920.00"
Centro de Investigaciones y Estudios Superiores en Antropología Social (CIESAS),Estrategia para Mejorar el Posicionamiento de Desacatos en el Sistema de Clasificación de Revistas Mexicanas de Ciencia y Tecnología del Consejo Nacional de Ciencia y Tecnología (CRMCYT) y de las Bases de Datos Comprensivas.,"Servicios Profesionales, Cientificos Y Tecnicos","108,888.13"
Universidad Autónoma Metropolitana - Unidad Iztapalapa,"Nuevas Estrategias de Visibilidad, Optimización de la Navegabilidad Web y Reorganización de la Política Editorial de la Revista Signos Históricos.",Servicios Educativos,"129,966.40"
Universidad Autónoma Metropolitana - Unidad Iztapalapa,"Nuevas estrategias de visibilidad, optimización de la navegabilidad web y reorganización de la política editorial de la revista Signos Filosóficos.",Servicios Educativos,"119,996.40"
Universidad Autónoma Metropolitana - Unidad Iztapalapa,"Desarrollo de estrategias de visibilidad, optimización de la navegabilidad web y consolidación de la política editorial de la revista Hidrobiológica.",Servicios Educativos,"129,708.80"
Universidad Autónoma de la Ciudad de México,"Generación de Red, digitalización y difusión electrónica de Andamios, Revista de Investigación Social.",Servicios Educativos,"119,909.00"
"Centros Culturales de México, A.C.","Plan de acción para posicionamiento de Tópicos, Revista de Filosofía",Servicios Educativos,"87,192.00"
El Colegio de Sonora,Región y sociedad: mejoramiento de la política editorial y de su visibilidad web,Servicios Educativos,"119,860.00"
Universidad Autónoma de Chapingo,Estrategias de mejoramiento integral de la Revista Chapingo Serie Ciencias Forestales y del Ambiente,Servicios Educativos,"129,984.00"
Universidad Autónoma de Chapingo,"Desarrollo de estrategias de visibilidad, optimización de la navegabilidad web y reorganización de la política editorial de la Revista Chapingo Serie Horticultura.",Servicios Educativos,"119,884.00"
Instituto Nacional de Psiquiatría Ramón de la Fuente Muñíz,Proyecto para el posicionamiento y mejora de la calidad de la revista Salud Mental.,"Servicios Profesionales, Cientificos Y Tecnicos","113,708.17"
Instituto de Investigaciones Dr. José María Luis Mora (MORA),"Plan Estratégico de Secuencia. Revista de historia y ciencias sociales para mejorar su posicionamiento nacional e internacional, 2017-2019.","Servicios Profesionales, Cientificos Y Tecnicos","113,442.00"
Instituto de Investigaciones Dr. José María Luis Mora (MORA),Proyecto de Posicionamiento Internacional de la Revista América Latina en la Historia Económica,"Servicios Profesionales, Cientificos Y Tecnicos","99,890.94"
Instituto Nacional de Cardiología Ignacio Chávez,Plan de Desarrollo en la Visibilidad y Posecionamiento Creacion Web Oficial como parte de la Estrategia para Alcanzar la Clasificacion Q2.,Servicios De Salud Y De Asistencia Social,"119,689.24"
"Sociedad Química de México, A.C.",Posicionar el Journal of the Mexican Chemical Society en el cuartil Q2 en la clasificación del JCR y SJR.,"Servicios Profesionales, Cientificos Y Tecnicos","129,950.00"
