"APP ID"	"Date Announced"	"CIA Name"	"Grant Type"	"Sub Type"	"Grant Title"	"Admin Institution"	"State"	"Sector"	"Total"	"Broad Research Area"	"Field(s) of Research"	"Res KW1"	"Res KW2"	"Res KW3"	"Res KW4"	"Res KW5"	"Plain Description"
"2008436"	2021-09-14	"Dr Dinh Bui"	"Investigator Grants"	"Emerging Leadership 1"	"Reducing the burden of chronic obstructive pulmonary disease (COPD): novel phenotypes, risk factors and biomarkers"	"University of Melbourne"	"VIC"	"University"	650740	"Public Health"	"Epidemiology"	"epidemiology"	"chronic obstructive pulmonary disease (COPD)"	"prevention"	"risk factors"	"phenotype"	"Chronic Obstructive Pulmonary Disease (COPD) is a major public health issue around the world. At present, the only known way to prevent COPD and lessen its severity is tobacco smoking avoidance. However, not everyone who gets COPD smokes and patients with COPD often have different forms of the disease. I will determine the different types and causes of COPD and develop tools to identify who is most at risk. My research will help develop interventions to prevent and better treat COPD."
"2008447"	2021-09-14	"Dr Alisa Higgins"	"Investigator Grants"	"Emerging Leadership 1"	"Healthcare resource utilisation and long term outcomes following critical illness"	"Monash University"	"VIC"	"University"	613240	"Clinical Medicine and Science"	"Health Economics"	"critical care"	"health outcomes"	"health economics"	"randomised controlled trial (RCT)"	"health care utilisation"	"Patients admitted to intensive care units (ICU) are the sickest patients in hospital but little is known about what happens to these patients after they are discharged. This project will evaluate long-term outcomes such as disability, quality of life, anxiety and depression after ICU, along with ongoing healthcare use (including readmission to hospital). It will also conduct health economic analyses to determine which interventions provide the greatest value for money."
"2008450"	2021-09-14	"Prof Alexander Loukas"	"Investigator Grants"	"Leadership 3"	"Next-generation therapeutics inspired by parasitic helminths"	"James Cook University"	"QLD"	"University"	3327015	"Basic Science"	"Medical Biotechnology Diagnostics (incl. Biosensors)"	"helminth infection"	"biological therapy"	"hookworms"	"schistosomiasis"	"vaccines"	"Billions of people in developing countries are infected with parasitic worms, but they have been eradicated from industrialised nations. Humans co-evolved with worms, so their recent removal has deprived us of signals required to keep inflammation in check. My research focuses on worm molecules that can be used as: (1) vaccines and diagnostics to combat parasitic infections in developing countries, and (2) a novel platform of anti-inflammatory therapeutics for use in industrialised nations."
"2008454"	2021-09-14	"Prof Anne Cust"	"Investigator Grants"	"Leadership 1"	"Tailored approaches to improve prevention and early detection of melanoma and other skin cancers"	"University of Sydney"	"NSW"	"University"	2023555	"Public Health"	"Preventive Medicine"	"cancer screening"	"melanoma"	"skin cancer"	"cancer prevention"	"cancer epidemiology"	"This proposal will evaluate ways to tailor melanoma and skin cancer prevention and early detection strategies to a person’s individual risk. It will help us understand the overall benefits and harms of different approaches, how to implement good national strategies, and measure the value for money for the health system. This research will improve skin cancer outcomes for the community and patients."
"2008460"	2021-09-14	"A/Prof Jo Robinson"	"Investigator Grants"	"Leadership 1"	"Using social media to reduce suicide and self-harm in young people"	"University of Melbourne"	"VIC"	"University"	2248555	"Public Health"	"Mental Health"	"suicide prevention"	"suicide"	"internet"	"young adults"	"adolescent"	"This program will address the role of social media on youth suicide and self-harm. It will lead to increased understanding of the harms and benefits of online communication from the perspective of young people, parents, professionals and the social media industry. Outputs include evidence-based guidance plus co-designed social media campaign targeting young people. If effective, this work will directly translate into increased online safety for at-risk young people in Australia and overseas."
"2008462"	2021-09-14	"Dr Jiawen Li"	"Investigator Grants"	"Emerging Leadership 1"	"Developing more accurate cardiovascular disease detection with a cellular-resolution imaging catheter"	"University of Adelaide"	"SA"	"University"	588308.31	"Clinical Medicine and Science"	"Biomedical Instrumentation"	"diagnostic imaging"	"acute myocardial infarction (AMI)"	"instrumentation"	"plaque rupture"	"atherosclerosis"	"Most heart attacks are caused by high-risk plaques. The holy grail in cardiology would be to reliably detect high-risk plaques before they are life-threatening. This research program will deliver a clinically applicable device to detect high-risk plaques, helping cardiologists determine the most efficient treatment on an individual basis. The imaging device will be the first-of-its-kind worldwide, holding great hope of significantly reducing cost and complications in cardiovascular diseases."
"2008488"	2021-09-14	"Prof Vicki Anderson"	"Investigator Grants"	"Leadership 2"	"Optimising outcomes from child concussion from sidelines to recovery: improving diagnostic precision, effective treatment and community knowledge"	"Murdoch Childrens Research Institute"	"VIC"	"Research Institutes"	3198056	"Clinical Medicine and Science"	"Clinical Sciences not elsewhere classified"	"concussion"	"child"	"youth"	"biomarkers"	"early intervention"	"In the context of wide media attention, child concussion is of increasing community concern, despite limited empirical evidence regarding its real consequences. My research will identify mechanisms underlying persistent symptoms and link these predictive markers to individual recovery profiles and to treatment responses to optimise outcomes for children with concussion."
"2008501"	2021-09-14	"Prof Richard Price"	"Investigator Grants"	"Leadership 3"	"Interventions to eliminate Plasmodium vivax malaria"	"Menzies School of Health Research"	"NT"	"Research Institutes"	2897045.75	"Clinical Medicine and Science"	"Infectious Diseases"	"clinical malaria"	"clinical trial"	"health economics"	"molecular biology"	"pharmacology"	"Malaria affects more 230 million people each year. In Asia, the Americas and the Horn of Africa malaria due to Plasmodium vivax accounts for more than half of these cases. I will work with partners in malaria endemic countries to develop better, safer and more effective treatment strategies and design better surveillance to identify populations at greatest risk of infection. The ultimate aim of my program is to change policy, impact on health outcomes and eliminate vivax malaria globally."
"2008523"	2021-09-14	"Dr Adam Culvenor"	"Investigator Grants"	"Emerging Leadership 2"	"Reducing the burden of knee osteoarthritis in young adults"	"La Trobe University"	"VIC"	"University"	1432688.31	"Clinical Medicine and Science"	"Physiotherapy"	"knee osteoarthritis"	"rehabilitation"	"exercise therapy"	"physiotherapy"	"sports injury"	"In young people (<40 years), arthritis commonly occurs after knee injury, forcing them to live with old knees and reducing their quality of life. This program of research leverages established resources to address the urgent need to prevent arthritis in young adults by: i) understanding why some people are more likely to get knee arthritis; ii) enhancing the care of knee injuries to prevent arthritis; and iii) uniting international efforts with a world-first database of early arthritis outcomes."
"2008535"	2021-09-14	"A/Prof Gary Sacks"	"Investigator Grants"	"Emerging Leadership 2"	"Enhancing policy implementation for healthy food environments"	"Deakin University"	"VIC"	"University"	1427980.49	"Public Health"	"Health Promotion"	"overweight/obesity"	"health policy"	"population health"	"nutrition"	"translational research"	"This Investigator Grant aims to enhance the implementation of policies for creating healthy food environments. It is expected that the research program will provide new evidence to support effective policy action, and powerful mechanisms for holding governments and the food industry to account for their roles in improving population diets and preventing obesity. In so doing, the research will improve the policy response to the leading contributors to poor health in Australia and globally."
"2008542"	2021-09-14	"Prof Gabrielle Belz"	"Investigator Grants"	"Leadership 3"	"Harnessing immune cell programs to drive immune protection"	"University of Queensland"	"QLD"	"University"	1941612	"Basic Science"	"Innate Immunity"	"transcription factor"	"innate immunity"	"mucosal immunity"	"immune protection"	"lymphocytes"	"Immunity is essential for life. Harnessing the immune system to drive increased protection against disease has never been more urgent than now. Achieving this requires understanding the cues that regulate the activation of immune cells and the wiring needed for them to function efficiently and defeat pathogens. My work aims to unravel this complex network to harness the immune switches that will facilitate the future development of therapeutics and vaccines to treat world disease."
"2008546"	2021-09-14	"Dr Mark White"	"Investigator Grants"	"Emerging Leadership 1"	"Novel oxygen sensing pathways in hypoxic disease"	"University of Sydney"	"NSW"	"University"	624389.97	"Basic Science"	"Analytical Biochemistry"	"hypoxia"	"oxygen"	"protein characterisation"	"protein degradation"	"solid tumours"	"Oxygen (O2) is a vital biological resource and sufficient concentrations are needed for normal metabolism. Reductions in O2 (hypoxia) can cause significant stress that subverts life and is a key feature of disorders such as cancer and cardiovascular disease. By understanding how cells respond to changes in O2 we can develop effective methods to treat these detrimental conditions. This project aims to increase knowledge of a new O2 sensing system to combat hypoxic cancers such as glioblastoma."
"2008565"	2021-09-14	"Dr Elie Matar"	"Investigator Grants"	"Emerging Leadership 1"	"From dreams to delirium and dementia: Cognitive fluctuations as a window into novel biomarkers and therapeutic targets for neurodegeneration"	"University of Sydney"	"NSW"	"University"	250000	"Clinical Medicine and Science"	"Neurology and Neuromuscular Diseases"	"dementia with Lewy bodies"	"Parkinson disease"	"rapid eye movement (REM) sleep"	"neurodegeneration"	"biomarkers"	"Lewy body dementias are characterized by marked swings in attention and arousal known as cognitive fluctuations. We aim to show that disturbances in the biology maintaining the normal balance between wakefulness and sleep underlie this core symptom and use this to identify new disease biomarkers and novel therapeutic targets of Lewy body disease. We apply this to recruit the first prodromal cohort of delirium-onset Lewy body dementia and to improve prediction and treatment of delirium generally."
"2008572"	2021-09-14	"Prof Tony Tiganis"	"Investigator Grants"	"Leadership 3"	"Phosphatases in the pathogenesis of obesity and cancer"	"Monash University"	"VIC"	"University"	1927015	"Basic Science"	"Signal Transduction"	"protein tyrosine phosphatase (PTP)"	"insulin signalling"	"immunotherapy"	"liver cancer"	"obesity"	"Obesity has reached epidemic proportions and is major driver of chronic human diseases, including type 2 diabetes, cardiovascular disease, fatty liver disease and cancer. This proposal will define key molecular mechanisms contributing to the development of obesity and its co-morbidities, especially liver disease and cancer. We will thereon seek to develop novel therapeutic approaches for combating obesity and these insidious and recalcitrant diseases."
"2008574"	2021-09-14	"A/Prof Peter Azzopardi"	"Investigator Grants"	"Emerging Leadership 2"	"Defining effective health actions for adolescents globally"	"Burnet Institute"	"VIC"	"Research Institutes"	870120	"Public Health"	"Public Health and Health Services not elsewhere classified"	"adolescent health"	"health inequalities"	"intervention"	"indigenous health"	"regional health"	"The world is now home to 1.8 billion adolescents, the largest population in human history. My earlier work has described the unmet health needs of these adolescents- the task now is to define how to best respond. Working in partnership with adolescents across Indigenous communities, Papua New Guinea and Myanmar, I will define the actions required to improve their health. I will define a package of actions that is informed by adolescents and can be implemented across health and education sectors."
"2008600"	2021-09-14	"Dr Julie Hennegan"	"Investigator Grants"	"Emerging Leadership 1"	"Measuring unmet menstrual health needs and their impacts on health and education"	"Burnet Institute"	"VIC"	"Research Institutes"	650740	"Public Health"	"Public Health and Health Services not elsewhere classified"	"menstruation"	"developing countries"	"social determinants"	"reproductive health"	"adolescent health"	"Each day, over 300 million females are menstruating. Their menstrual health matters for gender equality, health, and education. My work will transform the way we measure women’s and girls’ menstrual health needs in low- and middle-income countries and advance evidence-based action in Southeast Asia and the Pacific. I will grow our understanding of how adolescent girls’ needs change over time and quantify the impacts of menstrual health on broader health and education outcomes."
"2008612"	2021-09-14	"Prof Michael Breakspear"	"Investigator Grants"	"Leadership 2"	"Generative models of brain disorders"	"University of Newcastle"	"NSW"	"University"	2872570	"Clinical Medicine and Science"	"Central Nervous System"	"dynamic process modelling"	"neuroimaging"	"mathematical modelling"	"schizophrenia"	"dementia"	"The management of many neurological and psychiatric disorders remains underwhelming, due in part to of our limited understanding of how the brain works. Consequently, clinical practice remains rooted in trial-and-error and expert opinion. To make progress, we need to improve our knowledge of the brain using tools that embrace its complexity. I will use advanced mathematical modelling to understand the rules that govern neural circuits in health and as they fail in common brain disorders."
"2008616"	2021-09-14	"Prof James McCluskey"	"Investigator Grants"	"Leadership 3"	"Immunity mediated by MHC class I-related protein (MR1)"	"University of Melbourne"	"VIC"	"University"	2e+06	"Clinical Medicine and Science"	"Cellular Immunology"	"cellular immunology"	"antigen presentation"	"immune protection"	"tumour immunity"	"innate immunity"	"Immune T cells react to molecular changes in cells during infection revealed by antigen-presenting molecules that constantly sample molecular patterns. MR1 is a newly discovered Ag presentation molecule involved in microbial immunity, but new evidence indicates that MR1 can present unique molecules from cancer cells driving T cell immunity. This proposal seeks to understand this process to harness a new arm of immunity amenable to development of novel anti-tumour vaccines and immunotherapy."
"2008625"	2021-09-14	"Dr Steven Taylor"	"Investigator Grants"	"Emerging Leadership 1"	"Achieving precision care in chronic lung disease"	"South Australian Health and Medical Research Institute"	"SA"	"Research Institutes"	650740	"Basic Science"	"Medical Microbiology not elsewhere classified"	"molecular microbiology"	"chronic suppurative lung disorders"	"asthma"	"airway inflammation"	"airway diseases"	"Current treatment guidelines poorly manage up to 30% of all patients with a chronic lung disease (CLD). In order to improve this, we need to identify useful disease markers that inform treatment response. Using stored samples and data from thousands of CLD patients, I will meticulously measure markers of disease and identify patient characteristics that inform treatment response. This research will improve guidelines for the large number of patients with poor disease control."
"2008631"	2021-09-14	"Dr Olga Kondrashova"	"Investigator Grants"	"Emerging Leadership 1"	"Improving outcomes for patients with homologous recombination deficient cancer"	"QIMR Berghofer Medical Research Institute"	"QLD"	"Research Institutes"	650740	"Basic Science"	"Bioinformatics"	"ovarian cancer"	"breast cancer"	"DNA repair"	"targeted therapy"	"medical genomics"	"Some cancers, including ovarian and breast, have faulty DNA repair, which makes them respond to powerful cancer drugs called PARP inhibitors. Unfortunately, many cancers eventually develop resistance to these drugs. I will use genomic technologies to study the portraits of cancers with faulty DNA repair. I will look at how we can prevent resistance to PARP inhibitors and to treat each cancer most effectively. This important work aims to improve the cancer survival rates."
"2008632"	2021-09-14	"Dr Brendan McMullan"	"Investigator Grants"	"Emerging Leadership 1"	"Improving antimicrobial  use and reducing harms in children"	"University of New South Wales"	"NSW"	"University"	450370	"Health Services Research"	"Health Promotion"	"antimicrobial therapy"	"infection"	"paediatric"	"health service decision making"	"clinical epidemiology"	"Antibiotics are often given to children in hospital incorrectly or for longer than needed. My program makes use of routinely collected Australian data, and introduces improved systems for managing antibiotics in hospital, including guidelines and policy. The program will improve the reporting of how antibiotics are used in Australian hospitals, improve management of those antibiotics in children, and lead to better outcomes for children and families, with less time spent in hospital."
"2008640"	2021-09-14	"A/Prof Matthew Field"	"Investigator Grants"	"Emerging Leadership 2"	"Developing Bioinformatics Capability to Diagnose Infectious Diseases using Clinical Metagenomics"	"James Cook University"	"QLD"	"University"	1420530.96	"Basic Science"	"Genomics"	"bioinformatics"	"DNA sequencing"	"sequence analysis"	"genetic variation"	"computers"	"Current methods to identify infectious pathogens are time-consuming, inaccurate, and unable to detect novel pathogens. This research will develop the bioinformatics and clinical tools needed to implement unbiased metagenomic sequencing as an improvement to current practice in pathogen diagnostics. This new approach can be implemented in remote and regional healthcare settings and will have enormous global impact on the world’s expanding tropical population, who have limited access to healthcare."
"2008645"	2021-09-14	"Prof Enrico Coiera"	"Investigator Grants"	"Leadership 3"	"Bringing artificial intelligence into the real world of healthcare - the implementation challenge"	"Macquarie University"	"NSW"	"University"	1500000	"Health Services Research"	"Public Health and Health Services not elsewhere classified"	"implementation"	"safety"	"replication"	"computer-based decision support"	"artificial neural networks"	"This research program focuses on three foundational challenges to bringing artificial intelligence (AI) into the clinical world. To ensure AI is safe, the 1st challenge, the program will research optimal mechanisms for surveillance and governance of AI safety. The 2nd challenge addressed is the lack of genuine independent testing of claims for the benefits of AI.  The 3rd challenge for clinical AI is that good performance in one setting may not be repeated in even closely related settings."
"2008648"	2021-09-14	"A/Prof Ian Cockburn"	"Investigator Grants"	"Leadership 1"	"Understanding natural and vaccine-induced immunity to malaria"	"Australian National University"	"ACT"	"University"	1836259.93	"Basic Science"	"Medical Parasitology"	"malaria"	"B cells"	"T cells"	"vaccines"	"innate immunity"	"Malaria is responsible for the deaths of >400,000 individuals per year. Eradication of malaria will require a safe and effective vaccine. Vaccine development requires an understanding of the immune responses to malaria parasites and vaccines. The work here aims to understand the necessary components for a successful vaccine and to understand why our immune system struggles to make effective responses to malaria."
"2008649"	2021-09-14	"A/Prof Maree Toombs"	"Investigator Grants"	"Emerging Leadership 2"	"Transforming Young Aboriginal and Torres Strait Islander Mental Health through New Knowledge and Co-designed Healings"	"University of Queensland"	"QLD"	"University"	1000625.46	"Public Health"	"Traditional Aboriginal and Torres Strait Islander Medicine and Treatments"	"Aboriginal mental health"	"Aboriginal child"	"suicide prevention"	"primary care"	"disease prevalence"	"Young Indigenous Australians have one of the highest rates of suicide in the world and this tragic situation is worsening. My research program will address this call to action through collaborating with Indigenous youth and experts in the field, including traditional healers, to co-design a scalable Youth Model of Mental Health Care to reduce the rates of inter-generational trauma leading to mental illness and suicide/self-harm in young Indigenous Australians."
"2008650"	2021-09-14	"Dr Kerrie Wiley"	"Investigator Grants"	"Emerging Leadership 1"	"Integrating social science evidence into the fight against vaccine-preventable and vector-borne diseases in the Australasian, South East Asian and Pacific regions."	"University of Sydney"	"NSW"	"University"	650740	"Public Health"	"Pacific Peoples Health"	"social and behavioural research"	"vector-borne disease"	"vaccine-preventable diseases"	"behavioural intervention"	"disease prevention"	"Rejection of preventive health measures like vaccination is a global issue.  Knowing what drives it is crucial to how health authorities respond but they don’t currently have tools to measure these drivers . This research adds social / behavioural data and new analysis methods to health authorities’ toolkit, e allowing new understanding of how diseases behave in human populations, and how humans behave around those diseases, enabling  targeted public health interventions to reduce disease."
"2008652"	2021-09-14	"A/Prof Edwin Hawkins"	"Investigator Grants"	"Leadership 1"	"In situ visualisation of cell fate"	"Walter and Eliza Hall Institute of Medical Research"	"VIC"	"Research Institutes"	2598844	"Basic Science"	"Biochemistry and Cell Biology not elsewhere classified"	"microenvironment"	"imaging"	"cancer cell biology"	"blood diseases"	"autoimmunity"	"Maintaining millions of blood cells every day is crucial for health and development. When this process is compromised, we can develop a range of diseases including cancer and a compromised immune system. To understand how this complex system is regulated, we have developed technology to watch blood cell behaviour in living tissue. Using this approach, I aim to develop new ways of driving healthy blood cell production and eliminating cells that cause disease."
"2008692"	2021-09-14	"A/Prof James Vince"	"Investigator Grants"	"Leadership 1"	"Inflammatory Responses to Programmed Cell Death Signalling"	"Walter and Eliza Hall Institute of Medical Research"	"VIC"	"Research Institutes"	2348555	"Basic Science"	"Cell Development, Proliferation and Death"	"cell death"	"inflammation"	"signal transduction"	"innate immunity"	"ubiquitination"	"Inflammatory cytokines are the alarms that cells in our body engage to protect us against infections. However, when made in excess cytokines contribute to diseases such as arthritis, heart disease and hereditary inflammatory syndromes. This project aims to define the molecular mechanisms by which inappropriate cell death induces damaging levels of cytokines to cause disease.  Understanding how inflammation is controlled at the molecular level will allow the design of new, targeted, therapies."
"2008697"	2021-09-14	"Dr Kinley Wangdi"	"Investigator Grants"	"Emerging Leadership 1"	"Geospatial applications for the control of Tropical Infectious Diseases in the Asia-Pacific Region"	"Australian National University"	"ACT"	"University"	650740	"Public Health"	"Epidemiology"	"tropical disease"	"surveillance"	"disease modelling"	"prevention"	"cost-effectiveness"	"My research program will improve geographical mapping to better prevent, detect, and manage malaria, dengue, and intestinal worms in tropical countries. Projects include developing systems to rapidly map and report new cases of malaria to facilitate effective interventions, building an early warning system for dengue, and predicting high-risk areas for intestinal worms. The research will improve in the prediction, early warning, and rapid response to control and elimination of these diseases."
"2008698"	2021-09-14	"Prof Chun-Xia Zhao"	"Investigator Grants"	"Leadership 1"	"Novel nanotechnology strategies towards a new paradigm of precision nanomedicine"	"University of Adelaide"	"SA"	"University"	2248555	"Basic Science"	"Biomaterials"	"drug delivery systems"	"nanotechnology"	"biomaterials"	"drug delivery"	"biotechnology"	"Nanotechnology offers exciting prospects for many devastating diseases such as cancer. Despite the clinical success of a few nanomedicines, the development of cancer nanomedicines for effective and targeted delivery to pathogenic areas has  been limited. This project aims to develop revolutionising nanomedicines capable of simultaneous administration of two or more drugs in targeted cancer disease for synergistic therapy."
