"APP ID"	"Date Announced"	"CIA Name"	"Grant Type"	"Sub Type"	"Grant Title"	"Admin Institution"	"State"	"Sector"	"Total"	"Broad Research Area"	"Field of Research"	"Res KW1"	"Res KW2"	"Res KW3"	"Res KW4"	"Res KW5"	"Plain Description"
2000893	2020-12-15	"Dr Rachel Hill"	"Ideas Grants"	"Ideas Grants"	"ARX- A hub gene for a common biological pathway in schizophrenia"	"Monash University"	"VIC"	"University"	707974	"Basic Science"	"Central Nervous System"	"schizophrenia"	"animal model"	"behavioural science"	"genetic analysis"	"gamma-aminobutyric acid (gaba)"	"Schizophrenia is a severe psychiatric disorder with no cure. I have identified that some people with schizophrenia show variations to a gene called ARX. This project will use preclinical mouse models to explore how variations to the Arx gene affect brain molecules, networks of cells and behavioural outcomes. This biological pathway will provide the framework for the identification of new molecules to target therapeutically to modify the biological course of schizophrenia and improve outcomes."
2000905	2020-12-15	"Dr Jessica Grieger"	"Ideas Grants"	"Ideas Grants"	"Personalised nutrition to revolutionise gestational diabetes prevention"	"University of Adelaide"	"SA"	"University"	854007.6	"Basic Science"	"Obstetrics and Gynaecology"	"pregnancy"	"mathematical modelling"	"maternal nutrition"	"gestational diabetes"	"consumer participation"	"Gestational diabetes (GDM) affects 1 in 7 pregnant women, significantly increasing future risk for cardiovascular diseases in women and offspring. Clinical management of GDM is a healthy diet; but this one-size fits all approach is ineffective. We need to prevent GDM. We will use dietary modelling to inform culturally acceptable, personalised nutrition plans that will reverse metabolic risk factors to prevent GDM. Personalised nutrition represents a paradigm shift for current clinical care."
2000934	2020-12-15	"A/Pr Isabelle Rouiller"	"Ideas Grants"	"Ideas Grants"	"Structure and mechanism of activation of the mechanosensitive ion channel TACAN"	"University of Melbourne"	"VIC"	"University"	997536.7	"Basic Science"	"Structural Biology (incl. Macromolecular Modelling)"	"ion channels"	"pain mechanisms"	"electron microscopy"	"structural biology"	"electrophysiology"	"We propose to determine the structure and mechanism of activation of TACAN, a recently identified ion channel that defines a novel and uncharacterised class of channels. TACAN is specifically involved in sensing mechanical pain and contributes to mechanosensitive currents in the pain-receptor type of neurons. Our studies will increase knowledge of this novel class of proteins that will allow for the future development of treatments for several chronic pain conditions including arthritis."
2000937	2020-12-15	"Dr Thomas Cox"	"Ideas Grants"	"Ideas Grants"	"The collagen-rich matrix as a driver of breast cancer progression and resistance to therapy"	"University of New South Wales"	"NSW"	"University"	702230	"Basic Science"	"Cellular Interactions (incl. Adhesion, Matrix, Cell Wall)"	"extracellular matrix"	"breast cancer"	"collagen"	"fibroblasts"	"stroma"	"The extracellular matrix or 'matrix' surrounds all cells and is very important in controlling cell behaviour. In cancer, the matrix is dramatically altered, making cancer more aggressive. We recently developed a new way to study the matrix in breast cancer, and have analysed the matrix at different stages (Early/Mid/Late). We have uncovered exciting new matrix targets associated with more aggressive tumours. This project will validate their potential as therapeutic targets in breast cancer."
2000952	2020-12-15	"Prof Kelsey Hegarty"	"Ideas Grants"	"Ideas Grants"	"BETTER MAN Project: Tailored early online intervention for men using intimate partner violence"	"University of Melbourne"	"VIC"	"University"	506201.7	"Health Services Research"	"Health and Community Services"	"domestic violence"	"men's health"	"safety"	"injury prevention"	"child maltreatment"	"Domestic violence damages the health of families, particularly women and children. We aim to make all families safer by generating new knowledge from a world-first trial of a healthy relationship website (BETTER MAN). This website assists men to identify their use of abuse and violence early and motivate them to seek help. We will tailor their help-seeking response to their individual experiences. We will have the safety, health, and well-being of women and children as our focus in this work."
2000968	2020-12-15	"Dr Rebecca Nisbet"	"Ideas Grants"	"Ideas Grants"	"Development of an intracellular tau-specific antibody therapeutic for the treatment of Alzheimer's disease"	"University of Melbourne"	"VIC"	"University"	410378	"Basic Science"	"Cellular Nervous System"	"alzheimer disease"	"immunotherapy"	"neuron"	"adeno-associated virus"	"transgenic mouse"	"The protein, tau, is a promising therapeutic target for the treatment of Alzheimer's disease and related dementia's. Targeting tau is a challenge, however, as it is mostly localised within brain cells and a therapeutic must therefore be able to cross multiple barriers to engage and neutralise tau. This project overcomes this hurdle by using virus' to deliver a tau-specific antibody gene across the multiple barriers where it can be produced by brain cells and target intracellular tau."
2001010	2020-12-15	"Dr Nicola Lee"	"Ideas Grants"	"Ideas Grants"	"Central leptin control of energy partitioning"	"University of New South Wales"	"NSW"	"University"	684993	"Basic Science"	"Central Nervous System"	"neuropeptide y (npy)"	"leptin"	"obesity"	"bone"	"knockout mouse"	"This study aims to elucidate central pathways which can be manipulated to drive the storage of excess energy away from fat and instead directing it into the production of bone mass. Having identified leptin-responsive NPY neurons as important in the control of energy partitioning, we will focus on manipulating these neurons in the hypothalamus using innovative technology to alter body composition. This research has the potential to result in novel treatments for obesity and osteoporosis."
2001024	2020-12-15	"Prof Helen Cooper"	"Ideas Grants"	"Ideas Grants"	"Identifying an autism gene network governing stem cell division, neurogenesis and cortical malformation"	"University of Queensland"	"QLD"	"University"	1003589	"Basic Science"	"Cellular Nervous System"	"cortical development"	"neural stem cell"	"neurogenesis"	"cell adhesion molecule"	"autism spectrum disorders"	"Failure to produce neural stem cells and new neurons in the embryonic cortex results in cortical malformations and autism, and thus has profound consequences for the individual's survival and quality of life. Here we explore how a unique network of autism proteins maintains stem cell activity and neuronal production, thereby ensuring the fidelity of cortical development."
2001027	2020-12-15	"Prof Ross Bathgate"	"Ideas Grants"	"Ideas Grants"	"Relaxin receptor structural determination to aid therapeutic development"	"University of Melbourne"	"VIC"	"University"	1249114	"Basic Science"	"Basic Pharmacology"	"relaxin"	"g protein-coupled receptors"	"peptides"	"therapeutic target"	"drug development"	"The receptor for the peptide hormone relaxin, RXFP1, is being targeted by numerous drug companies for the treatment of cardiovascular disease. However, the lack of molecular detail of how relaxin binds and activates RXFP1 is hindering new drug development. We will determine the structure of the complex of relaxin bound to RXFP1 and the mechanism by which this activates cells. The knowledge gained will aid in the design of new drugs targeting RXFP1 for the treatment of cardiovascular disease."
2001066	2020-12-15	"A/Pr Alex de Marco"	"Ideas Grants"	"Ideas Grants"	"Developing high throughput single cell proteomics"	"Monash University"	"VIC"	"University"	1271854	"Basic Science"	"Analytical Biochemistry"	"proteomics"	"proteome analysis"	"cell biology"	"laser scanning confocal microscopy (lscm)"	"imaging"	"Unraveling the variability in the protein expression in tissues or cell populations is critical to understand how cells respond to their environment. For example, this can provide details about the cellular response to an infection or to a chemoterapic. As of today, single cell protein analyses has become at reach, but its application is still cumbersome and its throughput is low. This proposal aims to develop and deploy a simple and robust method to analyse the protein content in single cells."
2001073	2020-12-15	"Dr Paul Gilson"	"Ideas Grants"	"Ideas Grants"	"Development of novel anti-malaria drugs that block parasite invasion"	"Burnet Institute"	"VIC"	"Research Institutes"	1035623.1	"Basic Science"	"Medical Parasitology"	"antimalarial"	"falciparum malaria"	"malaria"	"malaria control"	"malaria drug resistance"	"Malaria is a devastating parasitic disease that kills over 400,000 people a year. Antimalarial drugs play a crucial role in helping eradicate malaria but of great concern is that parasites are becoming resistant to current drugs. We are developing drugs that prevent parasites from invading and proliferating in human blood which causes malaria. We are also discovering how the drugs work with the aim of greatly improving their performance towards clinical uptake."
2001083	2020-12-15	"Dr Sarah Auburn"	"Ideas Grants"	"Ideas Grants"	"Novel genetic tools for tracking the origins and spread of Plasmodium vivax"	"Menzies School of Health Research"	"NT"	"Research Institutes"	536157.9	"Clinical Medicine and Science"	"Genetics not elsewhere classified"	"malaria control"	"genetic epidemiology"	"population genetics"	"molecular biology"	"surveillance"	"Plasmodium vivax causes >8 million malaria cases annually. Containment of this parasite is constrained by limited surveillance tools. This project will establish genetic data on >6,000 P. vivax cases from across the globe. Using this data, we will develop an online platform with analytical tools to identify the main reservoirs of infection, how parasites are spreading within and across national borders, and how effectively interventions have impacted on parasite transmission."
2001090	2020-12-15	"Prof John Mamo"	"Ideas Grants"	"Ideas Grants"	"The interactive effects of dietary saturated fat and apolipoprotein-E genotype on peripheral metabolism of lipoprotein-amyloid and neurovascular integrity."	"Curtin University"	"WA"	"University"	637535.6	"Basic Science"	"Nutritional Physiology"	"lipoprotein metabolism"	"dietary fat"	"apolipoprotein e"	"blood-brain barrier"	"neurodegeneration"	"This project is based on a remarkable discovery which suggests that in some individuals, Alzheimer's disease may be a consequence of corruption of microscopic blood vessels that supply brain, damaged as a consequence of exaggerated exposure in blood to a protein produced principally in liver. The project will explore this pathway further in subjects at heightened risk of Alzheimer's disease and in humanised animal models. The findings may provide new opportunities for prevention and treatment."
2001098	2020-12-15	"Prof Vanessa Hayes"	"Ideas Grants"	"Ideas Grants"	"Mutational signatures of DDT: The role of a controversial persistent endocrine disrupting pollutant on prostate cancer aetiology"	"University of Sydney"	"NSW"	"University"	991000	"Basic Science"	"Cancer Genetics"	"genomics"	"carcinogens"	"mutagenicity"	"prostate cancer"	"pesticides"	"No carcinogen or prevention has been identified for prostate cancer (PCa). As carcinogens are commonly mutagens, we will use genomic interrogation to determine if extensive use of the hormone-disrupting pesticide DDT during the 40's to late 80's increased PCa globally. Having access to prostate tumours from men with biochemically confirmed lifelong DDT-exposure, will provide a measurable genomic signature to evaluate the impact of DDT globally, including Australia."
2001107	2020-12-15	"Prof Daniel Fatovich"	"Ideas Grants"	"Ideas Grants"	"Emerging Drugs Network of Australia: a coordinated toxicosurveillance system of illicit drug use in Australia to enable rapid detection and harm reduction responses via an Early Warning System"	"University of Western Australia"	"WA"	"University"	3722730.8	"Clinical Medicine and Science"	"Emergency Medicine"	"emergency medicine"	"toxicology"	"illicit drug use"	"health surveillance"	"harm reduction"	"The Emerging Drugs Network of Australia brings together emergency physicians, toxicologists and forensic laboratories across the country to build a national surveillance and early warning system of illicit and emerging drugs. Our innovative approach will use laboratory confirmed data to identify the specific drugs resulting in emergency department presentations, and use this information to inform rapid, evidence-based public health responses to reduce further drug-related harm in the community."
2001112	2020-12-15	"Prof John Carroll"	"Ideas Grants"	"Ideas Grants"	"Mitigating the risks of mitochondrial donation"	"Monash University"	"VIC"	"University"	1063748	"Basic Science"	"Gene and Molecular Therapy"	"mitochondrial disease"	"mitochondrial dna (mtdna)"	"oocyte"	"assisted reproductive technology (art)"	"mitochondrial genetics"	"Mitochondrial donation in fertilised eggs is a possible therapy for avoiding mitochondrial DNA disease, but there are major safety concerns, such as mutant mitochondrial carryover. To address these concerns, we will develop two new methods to eliminate carryover risk, then translate our findings to human eggs. Also, we will determine if the mitochondrial donation procedure affects offspring health. Our findings will serve as a guide for adopting the technology."
2001120	2020-12-15	"Prof Ruth Ganss"	"Ideas Grants"	"Ideas Grants"	"Therapeutic induction of tertiary lymph nodes in cancer"	"University of Western Australia"	"WA"	"University"	995010	"Basic Science"	"Solid Tumours"	"cancer immunotherapy"	"angiogenesis"	"stroma"	"targeted therapy"	"chemokines"	"Immunotherapy has been an important recent advance in cancer treatment by using the body's own immune cells to fight cancer. Although there have been unprecedented dramatic results, not all patients benefit, and most benefits are temporary. The cellular environment in which cancers are embedded is crucial for controlling treatment success. We aim to apply novel 'precision' therapies to this environment to expose the cancer and enable attack by immune cells for improved immunotherapy."
2001128	2020-12-15	"A/Pr Simon McMullan"	"Ideas Grants"	"Ideas Grants"	"Innate threat detection circuits in the superior colliculus co-ordinate respiratory and cardiovascular responses to visual stimuli"	"Macquarie University"	"NSW"	"University"	517958	"Basic Science"	"Autonomic Nervous System"	"autonomic nervous system"	"abnormal threat perception"	"visual pathways"	"sympathetic neurons"	"neuroanatomical tracing"	"Our surroundings affect our bodies: light pollution, traffic, and aircraft noise all significantly affect cardiovascular health. This project will investigate interactions between brain systems that subconsciously scan our surroundings for interesting or threatening features, and those that co-ordinate the cardiovascular and respiratory systems. We will generate new knowledge that describes how the brain detects danger and translates this into signals that contribute to cardiovascular risk."
2001131	2020-12-15	"A/Pr Rhys Allan"	"Ideas Grants"	"Ideas Grants"	"Organisation of the genome during the development of antibody-secreting cells"	"Walter and Eliza Hall Institute of Medical Research"	"VIC"	"Research Institutes"	886154.5	"Basic Science"	"Immunogenetics (incl. Genetic Immunology)"	"immune development"	"gene regulation"	"enhancer elements"	"immune function"	"b cells"	"Each cell of our body contains over two metres of DNA that must be correctly packaged in order for our cells to function. We are using cutting-edge molecular biology techniques to study how this DNA circuitry is established in the white blood cells of our immune system that produce antibodies. Our novel approaches will reveal unique strategies to modulate immune responses to our benefit."
2001173	2020-12-15	"Prof Marcia Langton"	"Ideas Grants"	"Ideas Grants"	"Improving understandings of and responses to alcohol-related family violence for Aboriginal people"	"University of Melbourne"	"VIC"	"University"	1294734.8	"Health Services Research"	"Aboriginal and Torres Strait Islander Health"	"aboriginal health"	"alcohol and behaviour"	"domestic violence"	"health services research"	"health service decision making"	"Family violence and alcohol misuse contribute to many health and social inequities facing Aboriginal peoples. This Aboriginal-led project will investigate associations between alcohol and family violence in urban, regional and remote contexts to co-design improved interventions for Aboriginal peoples facing these issues. We will use an innovative approach combining participatory anthropological methods with network analytical techniques to address the gravity and complexity of the problem."
2001201	2020-12-15	"Dr Gemma Kelly"	"Ideas Grants"	"Ideas Grants"	"Defining the genes that dictate the cellular response to tumour protein TP53 activation"	"Walter and Eliza Hall Institute of Medical Research"	"VIC"	"Research Institutes"	784895.9	"Basic Science"	"Cell Development, Proliferation and Death"	"apoptosis"	"cell proliferation"	"senescence"	"transcriptional regulation"	"mouse models"	"The tumour suppressor TP53 prevents the growth of abnormal cells by activating processes such as cell death and irreversible growth arrest. A cell will undergo only one of these possible responses, but it is not known why some cells die and others only stop growing. We will use innovative methods to define the genes that dictate the cellular response to TP53 activation. This research has implications for cancer, as many therapeutics aim to permanently kill cancer cells by activating TP53."
2001203	2020-12-15	"Dr Phillip Melton"	"Ideas Grants"	"Ideas Grants"	"Epigenetic Biomarker Discovery for Cardiovascular Disease Risk Stratification of Women Following Preeclampsia"	"University of Tasmania"	"TAS"	"University"	1275101	"Basic Science"	"Epigenetics (incl. Genome Methylation and Epigenomics)"	"cardiovascular disease"	"epigenetics"	"dna methylation"	"pre-eclampsia"	"population studies"	"Those women whom have suffered from severe complications during pregnancy have an increased risk of developing heart disease. This increased risk may be due to epigenetic changes during pregnancy that alter the expression of specific genes. These epigenetic changes persist after birth and increase heart disease risk for these women. This project seeks to evaluate those epigenetic changes associated with severe pregnancy complications predicting heart disease in a large group of Australian women."
2001210	2020-12-15	"Dr Freda Jen"	"Ideas Grants"	"Ideas Grants"	"Targeting a bacterial glyco-Achilles heel to make new vaccines for Haemophilus influenzae and Neisseria gonorrhoeae."	"Griffith University"	"QLD"	"University"	526949.6	"Basic Science"	"Medical Bacteriology"	"glycoconjugates"	"vaccine development"	"molecular microbiology"	"pathogenic bacteria"	"infectious diseases"	"The bacteria that cause gonorrhoea (N. gonorrhoeae), middle ear infections and exacerbations of chronic obstructive lung disease (H. influenzae) have become multi-drug resistant. These diseases are a major health and economic burden. In the absence of new drugs, a vaccine to prevent these diseases has emerged as a major unmet need in human health. In this grant, we will develop a new vaccine that targets a bacterial-specific sugar that we have discovered is the Achilles heel of these bacteria."
2001218	2020-12-15	"Prof David Forbes"	"Ideas Grants"	"Ideas Grants"	"Developing a Just-In-Time-Adaptive-Intervention for problem anger"	"University of Melbourne"	"VIC"	"University"	690123.6	"Clinical Medicine and Science"	"Health, Clinical and Counselling Psychology"	"anger"	"posttraumatic stress disorder (ptsd)"	"assessment"	"psychophysiology"	"psychological treatment"	"Problems controlling anger and aggression are very common and highly destructive in individuals who have experienced trauma. Current treatment approaches are limited. This project will first use technology to measure and predict when problem anger is occurring, and then develop a smart-phone delivered intervention designed to reduce problem anger in individuals who have experienced trauma, by providing support when and where an individual needs it most."
2001233	2020-12-15	"Prof Peter Currie"	"Ideas Grants"	"Ideas Grants"	"Harnessing macrophage-derived cytokine signalling in skeletal muscle regeneration"	"Monash University"	"VIC"	"University"	991926	"Basic Science"	"Regenerative Medicine (incl. Stem Cells and Tissue Engineering)"	"adult stem cells"	"muscle disease"	"macrophage biology"	"muscle regeneration"	"cytokine biology"	"We propose to develop novel therapies and tissue engineering approaches for the treatment of muscle injury and wasting disorders using specific muscle stem cells called satellite cells. Our ultimate aim is to accelerate the development of safe, effective and affordable muscle stem cell-based therapies, in an attempt to lessen the disease burden of muscle wasting disorders. The approach will make use of the novel stem cell activating compounds and immune cells that we have identified."
2001234	2020-12-15	"Dr Tracey Sletten"	"Ideas Grants"	"Ideas Grants"	"Understanding the role of light exposure in individual differences in the circadian response to shift work"	"Monash University"	"VIC"	"University"	803672.4	"Clinical Medicine and Science"	"Preventive Medicine"	"sleep"	"sleep disorders"	"circadian rhythms"	"shiftwork"	"mental health"	"This study will evaluate the effects of environmental light exposure on the response of the circadian pacemaker to night shift in a large sample of shift workers. It will refine a novel biomathematical model of the circadian pacemaker to improve predictions of circadian timing for individual shift workers. This prediction will inform personalised recommendations to enhance circadian adaptation to night shift and reduce the negative implications of circadian misalignment on health and safety."
2001262	2020-12-15	"Dr Andreas Kupz"	"Ideas Grants"	"Ideas Grants"	"A rationally designed vaccine for tuberculosis"	"James Cook University"	"QLD"	"University"	1371593	"Basic Science"	"Medical Bacteriology"	"tuberculosis"	"vaccine"	"indigenous health"	"diabetes"	"acquired immunodeficiency syndrome (aids)"	"Tuberculosis kills more people than any other infectious disease, and approximately one-third of the world's population is latently infected with Mycobacterium tuberculosis. This situation is largely due to the low efficacy of the only licensed TB vaccine, BCG, and the 'black box' of what constitutes protection against TB. This project aims to unravel the mechanisms of protective immunity against TB to develop a highly protective vaccine."
2001271	2020-12-15	"Dr Mark Larance"	"Ideas Grants"	"Ideas Grants"	"Characterisation of erusiolin - a new peptide hormone"	"University of Sydney"	"NSW"	"University"	547201.6	"Basic Science"	"Endocrinology"	"gut hormones"	"proteome analysis"	"appetite regulation"	"hormone receptors"	"knockout mouse"	"Obesity and type II diabetes are epidemic diseases in Australia. Gut-derived hormones are key mediators in these diseases, due to their role in regulating appetite and blood glucose levels. Therapeutic modulation of these hormones also provides significant benefits for patients. In this proposal, we will determine the metabolic functions, such as appetite control, for a previously uncharacterised hormone, which is an unexplored therapeutic target for obesity and diabetes."
2001278	2020-12-15	"A/Pr Mohammed Hossain"	"Ideas Grants"	"Ideas Grants"	"Developing novel peptide-based therapeutics and technologies to mitigate fibrosis"	"University of Melbourne"	"VIC"	"University"	1161383	"Basic Science"	"Proteins and Peptides"	"peptides"	"relaxin"	"peptide synthesis"	"pharmacology"	"g protein-coupled receptors"	"Fibrosis (tissue scarring) is an unmet medical problem that adversely affects both human health and medical devices. It causes organ (e.g. heart, kidney) failure leading to death. Fibrotic encapsulation causes medical device (e.g. surgical mesh) failure. Our team has discovered a peptide, B7-33, that mitigates fibrosis in the short-term. Our IDEAS grant aims to develop long-acting B7-33 therapies and, to employ long-acting B7-33 mimetics in anti-fibrotic compositions for surgical meshes."
2001283	2020-12-15	"A/Pr Luca Cocchi"	"Ideas Grants"	"Ideas Grants"	"Uncovering the neural mechanisms of obsessive-compulsive disorder using brain modelling"	"QIMR Berghofer Medical Research Institute"	"QLD"	"Research Institutes"	581628	"Basic Science"	"Neurocognitive Patterns and Neural Networks"	"neuroimaging"	"neuropsychiatry"	"brain imaging"	"mathematical modelling"	"psychological disorders"	"Obsessive-compulsive disorder (OCD) is an incurable mental illness and current therapies only mitigate its symptoms for a portion of individuals. Thus, there is a need to identify the neural causes of OCD to develop personalised therapies. We will combine mathematical modelling, computer simulations, and clinical and neuroimaging data to develop the first model of OCD. Outcomes from this study will enable targeted OCD research and the discovery of brain mechanisms supporting treatment response."
