"APP ID"	"Date Announced"	"CIA Name"	"Grant Type"	"Sub Type"	"Grant Title"	"Admin Institution"	"State"	"Sector"	"Total"	"Broad Research Area"	"Field of Research"	"Res KW1"	"Res KW2"	"Res KW3"	"Res KW4"	"Res KW5"	"Plain Description"
1196462	2020-05-20	"Dr Brendan Scott"	"Investigator Grants"	"Emerging Leadership 1"	"Low-intensity exercise with blood flow restriction: A novel training strategy to improve fitness and function in older people"	"Murdoch University"	"WA"	"University"	645205	"Health Services Research"	"Exercise Physiology"	"muscle strength"	"fitness"	"older people"	"exercise physiology"	"falls prevention"	"Age-related declines in muscle mass and cardiovascular fitness have debilitating effects on tasks of daily living for older people. Exercise helps to maintain physical abilities, but many older individuals cannot tolerate the recommended high-intensities of training. This research program will assess an innovative form of exercise to increase muscular and cardiovascular fitness for older people, combining low-intensity walking with wearing inflatable cuffs on the limbs to restrict blood flow."
1196492	2020-05-20	"Prof Jacob George"	"Investigator Grants"	"Leadership 3"	"Delineating the clinical and molecular heterogeneity of fatty liver disease to inform treatment"	"University of Sydney"	"NSW"	"University"	1731372	"Clinical Medicine and Science"	"Gastroenterology and Hepatology"	"fatty liver disease"	"hepatology"	"hepatitis"	"cirrhosis"	"liver cancer"	"Fatty liver disease from excess weight affects 1 in 3 adult Australians. The disease has no treatments and many patients develop liver failure or liver cancer. Clinically, the disease is characterized by marked heterogeneity, a challenge for developing biomarkers and treatments. To move towards precision medicine, this project will undertake an inter-disciplinary program that embraces disease complexity and integrates environmental and genetic risk with the power of mathematical modelling."
1196508	2020-05-20	"Prof Christos Pantelis"	"Investigator Grants"	"Leadership 3"	"Developing Novel Preclinical Models for Neurodevelopmental Disorders - From Bedside to Bench"	"University of Melbourne"	"VIC"	"University"	1714215	"Clinical Medicine and Science"	"Neurocognitive Patterns and Neural Networks"	"schizophrenia and related disorders"	"cognitive neuroscience"	"animal model"	"neuroimaging"	"treatment"	"I will use the knowledge gained from our studies of progressive brain structural and cognitive changes in neuropsychiatric disorders (esp. psychosis and schizophrenia), to develop novel animal models of brain development, identify the impact of insults (e.g. viral infection) at different stages of development, and identify new treatments and optimal timing of interventions to prevent or ameliorate brain changes and cognitive deficits."
1196514	2020-05-20	"A/Pr Kelvin Kong"	"Investigator Grants"	"Emerging Leadership 2"	"Improving Aboriginal Children's Access to Better Ear and Hearing Health through Telehealth ENT"	"University of Newcastle"	"NSW"	"University"	1123450	"Health Services Research"	"Aboriginal and Torres Strait Islander Health"	"aboriginal health"	"access to health care"	"otitis media"	"hearing loss"	"telemedicine"	"Aboriginal children experience the highest rates of chronic ear disease in the world, with access to specialist ENT care limited by cultural issues as well as long travel distances, if they live in rural areas. This results in children developing hearing loss that could have been prevented with early childhood ENT treatment. This Indigenous led telehealth research, based in NSW, will create an efficient, culturally appropriate hearing health care model for all Indigenous Australians."
1196516	2020-05-20	"Dr Rose Cairns"	"Investigator Grants"	"Emerging Leadership 1"	"Blocking paths to suicide: a data linkage program to identify modifiable risk factors for self-poisoning and suicide in Australia"	"University of Sydney"	"NSW"	"University"	501205.1	"Public Health"	"Toxicology (incl. Clinical Toxicology)"	"poisoning"	"suicide prevention"	"pharmacoepidemiology"	"injury prevention"	"toxicology"	"This research examines the relationship between medicines use and suicide. Some medicines may be more toxic than others and identification of these could allow for targeted restrictions. In addition, medication use practices may influence self-harm and suicide. This research will identify patterns (e.g. non-adherence prior to death, incorrect doses) to pinpoint beneficial or harmful practices. This will improve outcomes and help guide suicide prevention through targeted legislation and policy."
1196520	2020-05-20	"Prof Mark von Itzstein"	"Investigator Grants"	"Leadership 3"	"An interdisciplinary approach towards antiviral therapy discovery"	"Griffith University"	"QLD"	"University"	2e+06	"Basic Science"	"Medical Virology"	"structural biology"	"drug discovery"	"virology"	"receptor binding"	"carbohydrates"	"Viruses cause significant life-threatening diseases and our armament against viral infections is extremely limited. When coupled with resistance development,  humanity is at the mercy of existing and emerging life-threatening viruses. This project will provide new insight into how clinically- significant viruses that cause flu, croup and hand foot and mouth disease attack human cells, as well as discover new drug candidates that combat these viruses."
1196549	2020-05-20	"Dr Kefyalew Alene"	"Investigator Grants"	"Emerging Leadership 1"	"Spatially targeted intervention for eliminating tuberculosis in high-burden countries"	"Curtin University"	"WA"	"University"	645205	"Public Health"	"Epidemiology"	"tuberculosis"	"infectious diseases"	"modelling"	"geographic variations"	"cost-effectiveness"	"The overall goal of my research program is to design and implement an innovative approach for eliminating TB in high-burden countries such as Ethiopia and China. My project will integrate contemporary and sophisticated analytical methods (geospatial methods, network meta-analysis and economic analysis) within a single translational research framework and provide evidence to make a substantial shift from the current paradigm of passive case detection."
1196560	2020-05-20	"Dr Jonathan Brett"	"Investigator Grants"	"Emerging Leadership 1"	"Immediate and long-term safety of prescription opioids in pregnancy"	"University of New South Wales"	"NSW"	"University"	447602.5	"Health Services Research"	"Epidemiology"	"pharmacoepidemiology"	"pregnancy"	"outcome study"	"childhood"	"adolescent health"	"Little is known about the consequences of prescription opioid use during pregnancy for fetal and childhood development. In this study covering over 5 million mother-child pairs, we will investigate the safety of opioid use in pregnancy, by combining rich data sources from Australia, and the 5 Nordic countries. We will translate findings into policy, guidelines and messaging for medicine consumers and prescribers to protect the safety of women and children."
1196590	2020-05-20	"Dr Thomas Ve"	"Investigator Grants"	"Emerging Leadership 2"	"Structural biology and therapeutic targeting of axon degeneration"	"Griffith University"	"QLD"	"University"	1512250	"Basic Science"	"Structural Biology (incl. Macromolecular Modelling)"	"protein structure"	"enzyme activity"	"axonal degeneration"	"nicotinamide adenine dinucleotide (nad)"	"drug design"	"The molecular mechanisms underlying SARM1 (sterile alpha and TIR 1) function will be investigated, which will allow design of inhibitors of axon degeneration, which can be developed into therapeutic agents for neurodegenerative disease.  Outcomes are not only anticipated to support excellence in basic research, but have potential of assisting health sectors and the economy, by reducing the burden of prevalent neurodegenerative diseases such as peripheral neuropathies and traumatic brain injury."
1196598	2020-05-20	"Dr Marian Burr"	"Investigator Grants"	"Emerging Leadership 2"	"Targeting epigenetic mechanisms of immune evasion in cancer"	"University of Melbourne"	"VIC"	"University"	1425280.14	"Basic Science"	"Cancer Cell Biology"	"cancer biology"	"antigen presentation"	"epigenetics"	"immune evasion"	"cancer immunology"	"Proteins called MHC class I and II on the surface of cancer cells act as sensors that allow the immune system to recognise cancer cells as abnormal and destroy them. However, cancer cells have developed ways to hide from the immune system by silencing MHC class I and II. This project aims to identify ways to overcome this silencing and restore MHC class I and II to the surface of the cancer cells, allowing them to be treated with therapies that activate immune cells to eradicate the tumour."
1196605	2020-05-20	"Dr Willem Lesterhuis"	"Investigator Grants"	"Emerging Leadership 2"	"Tipping the balance - improving response rates to cancer immunotherapy"	"University of Western Australia"	"WA"	"University"	1562250	"Basic Science"	"Cancer Therapy (excl. Chemotherapy and Radiation Therapy)"	"cancer immunotherapy"	"drug discovery"	"translational research"	"oncology"	"systems biology"	"Survival rates for some types of cancer remain low. It was previously thought that chemotherapy could not be combined with drugs that affect the immune system (immunotherapy) to treat cancer. My research disproved this. I develop models to study cancer in the lab. I also research ways to measure how people’s bodies respond to chemotherapy and immunotherapy (biomarkers). I use this information to discover new drug combinations to reduce deaths from cancer."
1196636	2020-05-20	"Dr Rick Wassing"	"Investigator Grants"	"Emerging Leadership 1"	"Innovative Neuroscience to Improve Treatment of Sleep Disturbances for Prevention of Depression and Anxiety"	"University of Sydney"	"NSW"	"University"	645205	"Clinical Medicine and Science"	"Clinical Sciences not elsewhere classified"	"insomnia"	"mental health"	"cognitive behaviour therapy"	"emotion"	"arousal"	"Insomnia patients have disturbed sleep and symptoms similar to people with depression and anxiety. Treatments are far from optimal and have not progressed since the beginning of the century. My pioneering work identified insomnia patients at risk of depression and anxiety and revealed a potential way of targeting disturbed sleep to resolve emotional distress. Now, my mission is to understand why they are at risk and develop innovative treatments that reduce their risk for depression and anxiety."
1196637	2020-05-20	"Prof Samuel Berkovic"	"Investigator Grants"	"Leadership 3"	"Genetics of Epilepsy: Completing our understanding"	"University of Melbourne"	"VIC"	"University"	3e+06	"Clinical Medicine and Science"	"Neurology and Neuromuscular Diseases"	"epilepsy"	"genetics"	"molecular biology"	"mutation detection"	"seizures"	"Finding genetic causes of epilepsies is vital for accurate diagnosis and family counseling, to optimize current treatments and to develop novel therapies. We will leverage our large collection of carefully evaluated Australian cases with international data sets, coordinated by Consortia that I chair, to develop a detailed understanding of the genetic causes of epilepsy. This will transform the use of genetics in the clinic, lead to better immediate treatment and aid in developing novel therapies"
1196648	2020-05-20	"Prof John Gooding"	"Investigator Grants"	"Leadership 3"	"An in vitro pipeline for liquid biopsy biomarkers for cancer diagnosis and therapy"	"University of New South Wales"	"NSW"	"University"	3764215	"Basic Science"	"Nanomedicine"	"diagnostic methods"	"cell culture"	"biomarkers"	"cancer prognosis"	"cancer detection"	"A droplet of blood contains information whether a person has cancer, the stage of the cancer and how their response to treatment. The proposed research will employ ultrasensitive detection technologies to analyse so-called biomarkers released from cancer cells. We will use lab-based models of cancer, generated with a 3D bioprinter, to learn what biomarkers tell us about cancer type and response to drugs. This knowledge is urgently needed for early cancer detection and better cancer treatment."
1196724	2020-05-20	"Dr Karice Hyun"	"Investigator Grants"	"Emerging Leadership 1"	"Improving influenza vaccination rate for the prevention of cardiovascular events"	"University of Sydney"	"NSW"	"University"	645205	"Public Health"	"Primary Health Care"	"cardiovascular disease prevention"	"vaccination"	"primary care"	"data linkage"	"randomised controlled trial (rct)"	"Over the next 5 years, I will become an independent researcher and lead a program of work that improves heart care. My research will assess the association between high dose flu vaccine and the prevention of heart disease and test a general practice quality improvement program to enhance vaccination rate in Australia. This will deepen our understanding of the effect of flu vaccination and provide evidence to assist in generating guidelines/policies to help reduce heart disease among Australians."
1196749	2020-05-20	"Prof Mark Dawson"	"Investigator Grants"	"Leadership 1"	"Improving outcomes for cancer patients by targeting the epigenome"	"University of Melbourne"	"VIC"	"University"	2258892.29	"Clinical Medicine and Science"	"Cancer Cell Biology"	"epigenetics"	"cancer biology"	"transcriptional regulation"	"translational research"	"leukaemia"	"The most commonly mutated proteins in cancer involve so called epigenetic regulators, a class of proteins that regulate access to our DNA to control gene expression, DNA repair and replication. We and others have recently developed a variety of drugs to help inhibit the aberrant activity of these epigenetic proteins. My research will focus on ways to improve the efficacy of these existing drugs and find new epigenetic therapies to improve the survival of patients with a broad range of cancers."
1196755	2020-05-20	"Prof Sarah-Jane Dawson"	"Investigator Grants"	"Leadership 1"	"Circulating tumour DNA for precision medicine"	"University of Melbourne"	"VIC"	"University"	1544066.26	"Clinical Medicine and Science"	"Cancer Genetics"	"translational research"	"biomarkers"	"genomics"	"molecular diagnostics"	"clinical research"	"Many cancers shed small amounts of DNA (circulating tumour DNA or ctDNA) into the patient’s bloodstream. Recent technological advances now allow levels of ctDNA to be accurately measured in the blood.  Changes in ctDNA levels have potential to be used as specific markers of disease progression and/or response to cancer therapy.   This research will advance the use of ctDNA to serially follow patients and individualise treatment decisions in cancer management across several cancer types."
1196783	2020-05-20	"Dr Caitlin Cowan"	"Investigator Grants"	"Emerging Leadership 1"	"The developing microbiome as a predictor and modulator of mental health risk and resilience: A translational gut-brain axis approach to improving childhood mental health"	"University of Sydney"	"NSW"	"University"	645205	"Basic Science"	"Developmental Psychology and Ageing"	"child development"	"early detection"	"neuropsychological development"	"translational research"	"psychological disorders"	"Most psychological problems start to emerge in childhood or adolescence, likely because the brain is most vulnerable while it is still growing. The latest research suggests that brain health is intimately linked to the gut. Could bacteria in the gut contribute to risk of (or resistance to) mental health problems in children? This project will investigate this question and the information gathered will then be used to trial new, gut-based, approaches to protect children’s mental health."
1196831	2020-05-20	"Ms Alexandra Jones"	"Investigator Grants"	"Emerging Leadership 1"	"Regulatory strategies to promote healthier Australian diets"	"George Institute for Global Health"	"NSW"	"Research Institutes"	645205	"Public Health"	"Public Health and Health Services not elsewhere classified"	"food"	"regulation"	"policy evaluation"	"healthy eating"	"obesity"	"Unhealthy diets are a leading cause of ill health. In contrast to our global leadership in tobacco control, Australia remains slow to use law as a tool to support healthy eating. This project will generate new insights on features of effective food policies to target excess sugar consumption. Using an innovative fusion of law and science, its findings will inform and accelerate current proposals to improve food labelling and tax sugary drinks to promote healthier Australian diets."
1196832	2020-05-20	"Prof Peter-John Wormald"	"Investigator Grants"	"Leadership 2"	"From bench to bedside: A new treatment for chronic rhinosinusitis"	"University of Adelaide"	"SA"	"University"	2360520	"Clinical Medicine and Science"	"Otorhinolaryngology"	"rhinosinusitis"	"wound healing"	"surgical procedures"	"infection"	"chronic inflammatory disease"	"My research focuses on diseases of the upper airways, in particular chronic relapsing infections and inflammation of the nose and sinus mucosa and on improving wound healing after surgery. My research is translational, aimed at defining new treatments for these diseases. I have invented novel products that improve wound healing after surgery and instruments that help surgeons perform their surgeries in a better and safer way."
1196841	2020-05-20	"Dr Michael Clark"	"Investigator Grants"	"Emerging Leadership 2"	"Elucidating the pathological role and predictive value of mental health disorder risk genes"	"University of Melbourne"	"VIC"	"University"	1562250	"Basic Science"	"Neurogenetics"	"neuropsychiatric disorders"	"genetic risk factors"	"disease mechanisms"	"genomics"	"gene expression"	"Mental health disorders such as schizophrenia and depression are common and often debilitating conditions. The genes in our DNA play a large role in who develops these disorders and many risk genes have been identified. We will investigate when and how these risk genes are “switched on” to work out how they cause disease and to accurately predict who is at high risk of developing a mental health disorder. These advances will help us to understand disease causation and to improve treatments."
1196850	2020-05-20	"Dr Ruirui Qiao"	"Investigator Grants"	"Emerging Leadership 1"	"Biocompatible Gadolinium-free contrast agents for molecular targeted MR imaging"	"University of Queensland"	"QLD"	"University"	645205	"Basic Science"	"Nanomedicine"	"diagnostic imaging"	"molecular imaging"	"biomaterials"	"diagnostic applications"	"polymerisation"	"Building on the biomedical engineering of USPIOs, this project expects to generate new probing tools for non-invasive molecular imaging and affect subsequent clinical imaging through earlier and more accurate diagnosis of diseases. The project will allow the delivery of new knowledge in the emerging field of nanomedicine with high clinical translation potentials."
1196855	2020-05-20	"Prof Geoffrey Goodhill"	"Investigator Grants"	"Leadership 2"	"Mapping neurodevelopmental disorders in a zebrafish model"	"University of Queensland"	"QLD"	"University"	2760520	"Basic Science"	"Central Nervous System"	"zebrafish"	"autism spectrum disorders"	"fragile x syndrome"	"mathematical modelling"	"neural development"	"The way in which the brain develops differently in  neurodevelopmental disorders such as autism is hard to reveal in humans, but can be addressed in a zebrafish model. Using cutting-edge imaging and computational techniques, this project will investigate how neural representations of the world develop differently between normal zebrafish and zebrafish mutant for a gene that causes autism. This will provide new insights into the mechanisms of altered circuit development in autism."
1196881	2020-05-20	"Dr Sidonia Eckle"	"Investigator Grants"	"Emerging Leadership 1"	"The role of Mucosal-Associated Invariant T cells in protective and aberrant immunity"	"University of Melbourne"	"VIC"	"University"	620205	"Basic Science"	"Cellular Immunology"	"t cell immunity"	"t cell subset"	"antigen"	"parasitic infection"	"allergy"	"Despite their prevalence and potential therapeutic value, MAIT cells remain the least studied of all T cells. This program seeks to do paradigm shifting research into the role of MAIT cells in protective immunity to microbes and allergies. Thereby this project will significantly advance fundamental knowledge on MAIT cell biology and could furnish novel immunotherapeutic agents with an enormous potential as alternatives to microbial and allergy treatments, areas of tremendous clinical need."
1196892	2020-05-20	"Prof Daniel Lubman"	"Investigator Grants"	"Leadership 1"	"Transforming access to addiction treatment: overcoming system barriers and developing effective early intervention approaches"	"Monash University"	"VIC"	"University"	2195288	"Health Services Research"	"Mental Health"	"alcohol use disorders"	"drug treatment"	"telephone counselling"	"early intervention"	"population health"	"Addiction is one of the most highly stigmatised disorders in our community, resulting in a near two decade delay before people seek treatment. Although individuals with alcohol and drug problems present many times to health services, there are multiple missed opportunities for intervention. This research will identify opportunities to facilitate early help-seeking and treatment via insights through data linkage and machine learning, as well as testing novel telephone-based models of care."
1196904	2020-05-20	"Dr Stephanie Wong"	"Investigator Grants"	"Emerging Leadership 1"	"Challenging behaviours in dementia: mechanisms, assessment and interventions"	"University of Sydney"	"NSW"	"University"	645205	"Clinical Medicine and Science"	"Biological Psychology (Neuropsychology, Psychopharmacology, Physiological Psychology)"	"dementia"	"frontotemporal dementia"	"behavioural science"	"behavioural intervention"	"neuropsychology"	"This research program focuses on the behavioural symptoms of dementia. These symptoms are common, and can range from reduced motivation and empathy to overeating, gambling and socially-inappropriate or repetitive behaviour. Notably, these behaviours are challenging for carers and families to cope with, and often lead to patients being placed into aged care facilities. My research aims to understand why these symptoms develop and how we can manage these behaviours effectively."
1196924	2020-05-20	"Dr Debnath Ghosal"	"Investigator Grants"	"Emerging Leadership 1"	"Structural role of the host cytoskeleton during invasion of intracellular pathogens"	"University of Melbourne"	"VIC"	"University"	645205	"Basic Science"	"Structural Biology (incl. Macromolecular Modelling)"	"structural biology"	"microbial pathogenesis"	"host/pathogen interaction"	"bacterial pathogen"	"infectious diseases"	"During infection by bacteria, the 'skeleton' of cells plays critical roles in sensing the invading germs and destroying them. To counteract this, bacteria have evolved strategies to hijack the cell skeleton to promote their own survival, and spread. This intriguing molecular arms race is continuously co-evolving. Understanding this process in great details will have the potential to design novel therapeutics to counteract bacterial and viral infections."
1196945	2020-05-20	"Dr Wilson Wong"	"Investigator Grants"	"Emerging Leadership 2"	"Structural biology of malaria parasite invasion and antibodies-mediated inhibition"	"Walter and Eliza Hall Institute of Medical Research"	"VIC"	"Research Institutes"	1562250	"Basic Science"	"Structural Biology (incl. Macromolecular Modelling)"	"structural biology"	"electron microscopy"	"malaria"	"vaccine candidate molecules"	"invasion"	"Malaria results in significant mortality but an effective vaccine does not yet exist. The Rh5-CyRPA-Ripr complex is essential for malaria parasite to invade erythrocytes and is the leading vaccine candidate.  We aim to visualise the atomic details of the Rh5-CyRPA-Ripr complex during parasite invasion of erythrocytes and how antibodies neutralise this key protein complex. This information will advance knowledge on malaria parasite invasion, which will help to design an effective malaria vaccine."
1196948	2020-05-20	"Dr jake linardon"	"Investigator Grants"	"Emerging Leadership 1"	"Personalising the delivery of e-mental health interventions for eating disorders"	"Deakin University"	"VIC"	"University"	632428.51	"Clinical Medicine and Science"	"Health, Clinical and Counselling Psychology"	"eating disorders"	"binge eating disorder"	"bulimia nervosa"	"binge eating"	"psychotherapy"	"This Investigator Grant aims to evaluate the efficacy and cost-effectiveness of an eHealth prevention and treatment program using a stepped-care approach. Findings are expected to show that eating disorders can be effectively and efficiently treated and prevented through low intensity, cheap, and widely available digital interventions, and by doing so it will directly address the unmet needs of people with or at risk for an eating disorder in a practical, scalable, and cost-effective manner."
1196951	2020-05-20	"Dr David Thal"	"Investigator Grants"	"Emerging Leadership 2"	"Using protein structure and dynamics to facilitate drug discovery"	"Monash University"	"VIC"	"University"	1512250	"Basic Science"	"Structural Biology (incl. Macromolecular Modelling)"	"g protein-coupled receptors"	"structural biology"	"x-ray crystallography"	"pharmacology"	"drug discovery"	"G protein-coupled receptors (GPCRs) are the largest family of membrane proteins in the human genome, and drugs targeting these receptors account for 35% of marketed drugs. This project aims to determine atomic-level structural information of how drugs bind and specifically interact with therapeutically relevant GPCRs. Outcomes of this research will facilitate the design of future development of selective and effective drugs."
