"APP ID"	"Date Announced"	"CIA Name"	"Grant Type"	"Sub Type"	"Grant Title"	"Admin Institution"	"State"	"Sector"	"Total"	"Broad Research Area"	"Field of Research"	"Res KW1"	"Res KW2"	"Res KW3"	"Res KW4"	"Res KW5"	"Plain Description"
1191407	2020-02-06	"Prof Glenda Halliday"	"International Collaborations"	"NHMRC-EU Joint Programme on Neurodegenerative Disease Research (JPND) JPco-fuND-2 Grants"	"Diagnostic and prognostic precision medicine for behavioural variant frontotemporal dementia"	"University of Sydney"	"NSW"	"University"	498850	"Clinical Medicine and Science"	"Neurology and Neuromuscular Diseases"	"frontotemporal dementia"	"psychiatric disorders"	"neuroimaging"	"neuropathology"	"biomarkers"	"This project addresses the need for better diagnosis and prediction of disease for patients presenting with adult onset behavioral changes between 45 and 75 years of age. These patients may have a neurodegenerative disease called behavioural frontotemporal dementia, or a more treatable psychiatric disease. Current diagnosis takes on average 6 years. This project will develop new diagnostic models using new biological measures for individualized accurate diagnosis at presentation.
"
1191535	2020-02-06	"Dr Samantha Burnham"	"International Collaborations"	"NHMRC-EU Joint Programme on Neurodegenerative Disease Research (JPND) JPco-fuND-2 Grants"	"E-DADS: Early Detection of Alzheimer’s Disease Subtypes"	"Commonwealth Scientific and Industrial Research Organisation"	"ACT"	"Government"	488725	"Clinical Medicine and Science"	"Neurosciences not elsewhere classified"	"alzheimer disease"	"genetics"	"data linkage"	"lifestyle factors"	"data analysis"	"Alzheimer's disease manifests differently in different people. Some people may get the disease at younger ages or they may progress in the disease much faster than others. This grant aims to use large amounts of data from around the world to understand why these differences exist. This knowledge will be converted into a tool where data from a specific individual can be used to forecast if and when they will get the disease and how fast that disease will progress and how it could be prevented."
1191765	2020-02-06	"A/Pr Rosie Watson"	"International Collaborations"	"NHMRC-NIHR Collaborative Research Grants - 2019 Round 1"	"COmBining memantine And cholinesterase inhibitors in Lewy body dementia treatment Trial (COBALT)"	"University of Melbourne"	"VIC"	"University"	1218120.05	"Clinical Medicine and Science"	"Clinical Sciences not elsewhere classified"	"dementia"	"dementia with lewy bodies"	"parkinson disease"	"clinical trial"	"geriatrics"	"Many people who have been diagnosed with dementia with Lewy bodies or Parkinson’s disease dementia will be prescribed drugs known as acetylcholinesterase inhibitors (e.g. donepezil, rivastigmine, galantamine) to help with their symptoms. This research trial, known as COBALT, is designed to find out whether there is any benefit from taking the drug memantine as well. Australian and UK researchers are collaborating on this trial which will recruit eligible participants from both countries."
1191861	2020-02-06	"Prof Colin Masters"	"International Collaborations"	"NHMRC-EU Joint Programme on Neurodegenerative Disease Research (JPND) JPco-fuND-2 Grants"	"Blood Proteins for early Discrimination of dEmentias"	"University of Melbourne"	"VIC"	"University"	498412.2	"Clinical Medicine and Science"	"Medical Biochemistry: Proteins and Peptides (incl. Medical Proteomics)"	"dementia"	"alzheimer disease"	"dementia with lewy bodies"	"frontotemporal dementia"	"biomarkers"	"bPRIDE aims to develop blood biomarkers for early and specific diagnosis of the main dementia types: Alzheimer's disease, frontotemporal dementia and dementia with Lewy bodies, and use these to develop diagnostic tests."
1193803	2020-02-06	"Dr Victoria Ross"	"International Collaborations"	"NHMRC-EU Collaborative Research Grants"	"Mental health promotion and intervention program in the Australian context: MINDUP Australia"	"Griffith University"	"QLD"	"University"	421778.8	"Public Health"	"Mental Health"	"mental health"	"suicide prevention"	"occupational health"	"randomised controlled trial (RCT)"	"intervention study"	"MINDUP Australia aims to address poor mental health and elevated suicide risk in the construction, health and ICT sectors by contributing to the monitoring and evaluation of the European MINDUP workplace intervention. In addition, MINDUP Australia will enhance and extend the European MINDUP project by implementing a cluster randomised controlled trial within the construction industry in Australia. The trial will be conducted in close collaboration with industry partner, Mates in Construction."
1194128	2020-02-06	"Prof Roslyn Boyd"	"International Collaborations"	"NHMRC-EU Collaborative Research Grants"	"Born-To-Get-There: Implementation of early detection and early intervention in remote Australia"	"University of Queensland"	"QLD"	"University"	499329.5	"Clinical Medicine and Science"	"Paediatrics"	"cerebral palsy"	"cerebral palsy treatments"	"maternal mental health"	"indigenous Australians"	"implementation"	"Cerebral palsy (CP) is the most common physical disability in childhood in both high and low-to-middle income countries. The BORN-TO-GET-THERE program will use current evidence on early detection and early interventions for infants at high risk of CP by implementing the International Guideline in Europe, Low income countries and remote populations in Australia (QLD, WA) to improve child motor and learning outcomes and parent mental health."
1194234	2020-02-06	"Prof Helena Teede"	"International Collaborations"	"NHMRC-EU Collaborative Research Grants"	"IMPlementaion ACTion to prevent DIABETES from Bump 2 Baby (IMPACT DIABETES B2B)"	"Monash University"	"VIC"	"University"	497609.1	"Public Health"	"Preventive Medicine"	"pregnancy"	"gestational diabetes"	"type 2 diabetes mellitus (non-insulin dependent diabetes mellitus)"	"lifestyle"	"prevention"	"The IMPACT BUMP 2 BABY (DB2B) multicentre international European Union co-funded program aims to improve healthy lifestyle to prevent gestational diabetes and type 2 diabetes in high risk women and improve the health of their babies over the first 1000 days. Australia is one of four countries that will lead and undertake this work to co-design, implement and evaluate a novel, low cost ,supportive lifestyle intervention for the 30% of women at risk of these conditions in pregnancy and beyond."
1195743	2020-02-06	"Prof Lachlan Coin"	"International Collaborations"	"NHMRC-EU Collaborative Research Grants"	"DIAMONDS - Diagnosis and Management of Febrile Illness using RNA Personalised Molecular Signature Diagnosis"	"University of Melbourne"	"VIC"	"University"	391896.6	"Clinical Medicine and Science"	"Immunology not elsewhere classified"	"infectious diseases"	"gene expression"	"bioinformatics"	"inflammation"	"sepsis"	"We will develop and validate technologies to provide rapid diagnosis to patients presenting to primary care and hospitals on the basis of gene expression signatures in blood."
1195937	2020-02-06	"Prof Luis Salvador-Carulla"	"International Collaborations"	"NHMRC-EU Collaborative Research Grants"	"European platform to promote wellbeing and health in the workplace (EMPOWER)"	"Australian National University"	"ACT"	"University"	499221.8	"Public Health"	"Mental Health"	"electronic health information"	"depression"	"anxiety"	"prevention"	"employment"	"Productivity loss related to mental illness. Digital technologies improve mental health and wellbeing at the workplace. A multimodal digital platform is the software of a website allowing for the interaction of its users and including different modules such as apps, chatbots and virtual assistants. This will be the first multimodal platform developed in Europe. We will provide a critical knowledge transfer for its design, pilot and implementation and will coordinate the impact analysis."
1196800	2020-02-06	"Prof David Walker"	"International Collaborations"	"NHMRC-EU Collaborative Research Grants"	"Brain injury in the premature born infant: stem cell regeneration research network"	"RMIT University"	"VIC"	"University"	496586.5	"Clinical Medicine and Science"	"Paediatrics and Reproductive Medicine not elsewhere classified"	"stem cells"	"perinatal"	"neonatology"	"neuroprotection"	"premature infant"	"This project will validate to the stage of clinical trials a human mesenchymal stem cell paradigm to prevent brain injury associated with preterm birth: encephalopathy of prematurity (EoP), which leads to lifelong disability in millions of infants every year. We will achieve this by applying our vast expertise in EoP, across 7 in vivo and 11 in vitro models of EoP, by applying cutting-edge imaging approaches and partnering with experienced patient/consumer advocacy and industry partners."
1180474	2020-03-06	"A/Pr Paulo Ferreira"	"Partnership Projects"	"Partnership Projects - 2nd call for 2019"	"The Get Healthy Coaching Service to reduce the burden of low back pain: effectiveness, cost effectiveness, and scalability"	"University of Sydney"	"NSW"	"University"	1108389	"Public Health"	"Medical and Health Sciences not elsewhere classified"	"low back pain"	"musculoskeletal disorders"	"physical activity"	"public health costs"	"implementation"	"Many improve after discharge from treatment for low back pain (LBP), however some experience worsening symptoms and seek costly additional health care. Get Healthy Service® is a free phone-based health coaching service that supports people to remain physically active, however there is no co-ordinated referral pathway to the service. We will test the effectiveness, cost-effectiveness and scalability of a discharge support system linking chronic LBP patients to the Get Healthy Service®."
1189756	2020-03-06	"Prof John Wiggers"	"Partnership Projects"	"Partnership Projects - 2nd call for 2019"	"A practice change intervention to increase the routine provision of care addressing gestational weight gain: a stepped-wedge trial"	"University of Newcastle"	"NSW"	"University"	734163	"Health Services Research"	"Health Promotion"	"health promotion"	"intervention study"	"maternal health"	"randomised controlled trial (rct)"	"health services research"	"Unhealthy weight gain during pregnancy contributes to a range of adverse outcomes for the mother and child. Despite guidelines recommending routine weighing and weight gain care be provided by antenatal services, less than 10% of health professionals provide such care, and 50-70% of women gain weight outside of recommended levels during pregnancy. This study aims to determine if a practice change intervention can increase antenatal clinician delivery of recommended gestational weight gain care."
1190373	2020-03-06	"Dr Nicole Nathan"	"Partnership Projects"	"Partnership Projects - 2nd call for 2019"	"A randomised trial of an intervention to sustain schools’ implementation of a state-wide physical activity policy"	"University of Newcastle"	"NSW"	"University"	1054151	"Health Services Research"	"Public Health and Health Services not elsewhere classified"	"implementation"	"physical activity"	"policy evaluation"	"translational research"	"health behaviours"	"Sustaining effective health programmes in community-based settings is a considerable public health challenge. This study, the first RCT of its kind, will test the effectiveness of a sustainability strategy on the proportion of primary school classes that sustain implementation of a physical activity policy as mandated by the NSW Government. The trial could provide a model for supporting schools to sustain school health or education policies, which seek to improve wellbeing of students."
1191793	2020-03-06	"Prof Danielle Mazza"	"Partnership Projects"	"Partnership Projects - 2nd call for 2019"	"The AusCAPPS Network: A community of practice to support the provision of long acting reversible contraception and medical termination of pregnancy in primary care"	"Monash University"	"VIC"	"University"	1207160	"Health Services Research"	"Primary Health Care"	"abortion"	"contraception in female"	"women's health"	"access to health care"	"primary care"	"The Australian Contraception and Abortion Primary Care Practitioner Support (AusCAPPS) Network aims to provide much needed support to general practitioners, pharmacists and nurses working in primary care to improve the delivery of long acting reversible contraception and medical termination of pregnancy to Australian women. Increasing the delivery and access to these services in primary care will decrease unintended pregnancies and improve health outcomes for Australian women."
1191874	2020-03-06	"Prof Jane Pirkis"	"Partnership Projects"	"Partnership Projects - 2nd call for 2019"	"Preventing suicide in public places"	"University of Melbourne"	"VIC"	"University"	415920	"Public Health"	"Mental Health"	"suicide"	"suicide prevention"	"suicide risk"	"injury prevention"	"mental health"	"Addressing suicides in public places that have become known as ‘suicide hotspots’ is critical. We will examine which interventions work at hotspots, how and why they work, whether particular features are key to their success, whether they work best in combination with other interventions, whether they have unintended consequences, and whether they are cost-effective. Our research will culminate in a resource that provide practical guidance about how best to deal with suicide hotspots."
1191897	2020-03-06	"A/Pr Gary Sacks"	"Partnership Projects"	"Partnership Projects - 2nd call for 2019"	"Supporting food companies to implement policies for improving population nutrition"	"Deakin University"	"VIC"	"University"	309498	"Public Health"	"Health Promotion"	"dietary factors"	"health promotion"	"obesity"	"population health"	"policy evaluation"	"This proposal is to conduct a randomised-controlled trial to assess the effects of providing tailored support to food companies to improve their nutrition-related policies and practices. The aim of the project is to improve the healthiness of the food supply, and thereby improve population diets in Australia and New Zealand. The project will be conducted by leading international food policy experts in partnership with the Australian Government Department of Health and VicHealth."
1193596	2020-05-20	"Prof Paul Fitzgerald"	"Investigator Grants"	"Leadership 2"	"Brain stimulation therapeutics for mental health disorders: from concept to clinical application"	"Monash University"	"VIC"	"University"	2116312	"Clinical Medicine and Science"	"Psychiatry (incl. Psychotherapy)"	"transcranial magnetic stimulation (tms)"	"depression"	"mental disorder"	"treatment-resistant"	"obsessive-compulsive disorder (ocd)"	"This fellowship application will support a program of research to develop and expand the use of a number of forms of non-invasive brain stimulation. These will be used to dramatically enhance the range of therapeutic options available for patients with common mental health conditions such as depression. This will include trials to advance the application of existing treatments, develop a fundamentally new home based device therapy and support a new clinical trials network."
1193598	2020-05-20	"A/Pr Nicholas Opie"	"Investigator Grants"	"Emerging Leadership 2"	"Responsive Endovascular Neuromodulation: Detection and Suppression of Epileptic Seizures"	"University of Melbourne"	"VIC"	"University"	1487455.48	"Basic Science"	"Medical Devices"	"epilepsy"	"biomedical engineering"	"instrumentation"	"seizures"	"vascular prosthesis"	"For millions of people with epilepsy, seizures can be debilitating and dangerous. Medical devices approved for seizure prevention require risky open-brain surgery and traumatic electrode insertion. The Stentrode can record and stimulate the brain from within a blood vessel. By optimising it for delivery into small vessels, designing software to detect seizures, and conducting chronic safety studies, I will create a tool that can detect and suppress epileptic seizures without the surgical risk."
1193618	2020-05-20	"Dr Michael Doyle"	"Investigator Grants"	"Emerging Leadership 1"	"Alcohol treatment for Aboriginal men in and out of prison"	"University of Sydney"	"NSW"	"University"	607263.74	"Public Health"	"Aboriginal and Torres Strait Islander Health"	"aboriginal health"	"alcohol use disorders"	"prison population"	"behavioural intervention"	"health service utilisation"	"Over half the Aboriginal or Torres Strait Islander people entering prison in NSW have unhealthy alcohol use (drinking over recommended limits, including alcohol dependence). Better access to evidence-based treatment is needed to improve health and reduce return to prison. My proposed research focuses on how clinical and behavioural treatments for alcohol use disorders can be improved on entry to prison, in prison and on release."
1193630	2020-05-20	"Prof Stephen Fox"	"Investigator Grants"	"Leadership 2"	"Translating molecular pathology into cancer diagnostics"	"University of Melbourne"	"VIC"	"University"	2285520	"Clinical Medicine and Science"	"Pathology"	"biomarkers"	"pathology"	"diagnostic methods"	"oncology"	"breast cancer"	"Precision oncology, the treatment of cancer patients selected with a particular molecular characteristic (biomarker) matched to a therapy, has transformed the treatment of cancer patients. However, many biomarkers used for clinical care are not reliable and do not perform their role. I will translate new research tests from fundamental discovery, clinical trials and the development of novel diagnostics using innovative high throughput laboratory technologies to enhance patient outcomes."
1193647	2020-05-20	"Prof Eric Reynolds"	"Investigator Grants"	"Leadership 3"	"The bacterial type IX secretion system in polymicrobial dysbiosis and chronic inflammation"	"University of Melbourne"	"VIC"	"University"	1900000	"Basic Science"	"Dentistry not elsewhere classified"	"periodontitis"	"microbiology"	"immune response"	"virulence factors"	"protein secretion"	"Periodontitis (severe gum disease) affects 1 in 3 adults and has been linked with heart attacks, cancer and dementia. I will lead a multidisciplinary team investigating the interaction between disease causing bacteria in the mouth and the immune response which results in destruction of the tooth’s supporting tissues and allows bacteria to enter the blood stream. The expected outcome is the development of a novel therapy which will stop progression of disease associated with these pathogens."
1193648	2020-05-20	"Prof Russell Dale"	"Investigator Grants"	"Leadership 1"	"Targeting the immune cells of the brain to develop novel treatments for neurodevelopmental and mental health problems in children"	"University of Sydney"	"NSW"	"University"	1800000	"Clinical Medicine and Science"	"Paediatrics"	"neurodevelopmental disorders"	"mental health"	"neuroscience"	"inflammation"	"therapy"	"Neurodevelopmental and mental health problems are common in children and cause major impairment and cost to society. This research will define how the maternal immune system while pregnant can affect the baby brain. Using patient studies and laboratory research, this research will result in novel ways to reduce the prevalence and severity of developmental and mental health problems in children and adults, by targeting the immune cells resident in the brain."
1193745	2020-05-20	"Dr Alexandra Corbett"	"Investigator Grants"	"Leadership 1"	"Targeting vitamin-reactive T cells for enhanced immunity"	"University of Melbourne"	"VIC"	"University"	2590576	"Basic Science"	"Cellular Immunology"	"t cell immunity"	"antigen presentation"	"cellular immunity"	"infection"	"immunopathology"	"A specialised set of T cells called mucosal-associated invariant T (MAIT) cells react against bacteria and yeast, and reside at mucosal sites where the body's immune defences are often breached, e.g. respiratory tract and intestinal mucosa. This study seeks to define the molecular signals driving the function of MAIT cells, particularly during infections. This information may lead to methods tailored to manipulating MAIT cells therapeutically."
1193750	2020-05-20	"A/Pr Justin Denholm"	"Investigator Grants"	"Emerging Leadership 2"	"Tuberculosis elimination in Australia through targeting latent infection"	"University of Melbourne"	"VIC"	"University"	950000	"Public Health"	"Epidemiology"	"tuberculosis"	"public health impact"	"infectious diseases"	"ethics"	"epidemiology"	"Australia has committed to reducing the number of people who become sick with tuberculosis (TB), towards eventual elimination. Identification of those at risk is needed, which means significant expansion of detection and treatment of latent TB. This research will evaluate impact, cost-effectiveness and community priorities around TB elimination, and introduce a GP-based treatment service for safe and accessible care. It will provide a basis for large-scale programs towards TB elimination."
1193766	2020-05-20	"A/Pr Kim Delbaere"	"Investigator Grants"	"Leadership 1"	"Active Lifestyle Programs for Healthy Ageing (ALPHA)"	"University of New South Wales"	"NSW"	"University"	2305159.88	"Public Health"	"Preventive Medicine"	"falls prevention"	"clinical trial"	"physical activity"	"healthy ageing"	"self-management"	"The growing healthcare and service needs of our ageing society warrant our urgent attention. My research program will identify critical gaps in our current understanding on how to make healthy ageing more equitable and evaluate the effectiveness of novel self-managed lifestyle interventions. Ultimately, this will reduce falls and falls injuries, improve healthy ageing and reduce the associated healthcare expenditure on acute care, rehabilitation and home care services."
1193781	2020-05-20	"A/Pr Maria Inacio"	"Investigator Grants"	"Emerging Leadership 2"	"How to Address the ‘Shocking Tale of Neglect’ in Aged Care Through Transparency, Accountability, and the Use of High-Quality Analytics"	"University of South Australia"	"SA"	"University"	1337350	"Health Services Research"	"Aged Health Care"	"aged care"	"register"	"quality of care"	"safety"	"risk prediction"	"The Royal Commission into Aged Care shows that an improved understanding of how the aged care sector is caring for older Australians is a national priority. The Registry of Senior Australians, a large-scale registry database that I developed, will be used to evaluate the health and wellbeing of older Australians. This research will enable me to develop and implement a transparent outcome monitoring system and tools to address the “Shocking Tale of Neglect” older Australians are experiencing."
1193826	2020-05-20	"A/Pr Colleen Lau"	"Investigator Grants"	"Emerging Leadership 2"	"Building Decision Support Systems to Combat Emerging Infectious Diseases and Neglected Tropical Diseases: A Precision Public Health Approach"	"Australian National University"	"ACT"	"University"	1562250	"Public Health"	"Epidemiology"	"infectious diseases"	"surveillance"	"mapping"	"epidemiology"	"modelling"	"Emerging infectious diseases and neglected tropical diseases cause significant disease burden globally, and pose major health security threats in the Asia Pacific. The frequency and severity of disease outbreaks are increasing, mostly driven by environmental and socio-demographic change. My research program will use cutting-edge technologies and analytics to develop interactive, dynamic and user-friendly decision support systems that optimise surveillance and control of infectious diseases."
1193838	2020-05-20	"Prof Martha Hickey"	"Investigator Grants"	"Leadership 2"	"Better evidence and new tools to improve health after surgical menopause"	"University of Melbourne"	"VIC"	"University"	1855260	"Clinical Medicine and Science"	"Obstetrics and Gynaecology"	"menopause"	"women's health"	"cohort study"	"cancer prevention"	"cardiovascular disease prevention"	"Surgical menopause is removal of both ovaries before natural menopause. Surgical menopause may have severe adverse health consequences including short-term symptoms and long-term risk of chronic disease, but more information is needed to inform evidence-based care. This study will deliver the best available evidence internationally on the short (up to 5 year) and long (>20 year) consequences of surgical menopause and new tools for clinicians and patients to integrate this evidence into practice"
1193840	2020-05-20	"Prof Peter Sly"	"Investigator Grants"	"Leadership 3"	"Early life exposures and chronic disease: mechanisms and preventative strategies"	"University of Queensland"	"QLD"	"University"	2714215	"Clinical Medicine and Science"	"Respiratory Diseases"	"lung development"	"environmental pollutants"	"oxidative stress"	"chronic illness prevention"	"asthma"	"The world is in the grips of an epidemic of chronic disease and exposure to pollution in early life is partly responsible. To change this situation we need to understand and mitigate the mechanisms linking early life pollution exposure to life-long disease risk. My research will provide direct evidence of how pollution increases disease risk and design and implement strategies to reduce this, with an emphasis on asthma, cystic fibrosis and chronic respiratory disease."
