"APP ID"	"Date Announced"	"CIA Name"	"Grant Type"	"Sub Type"	"Grant Title"	"Admin Institution"	"State"	"Sector"	"Total"	"Broad Research Area"	"Field(s) of Research"	"Res KW1"	"Res KW2"	"Res KW3"	"Res KW4"	"Res KW5"	"Plain Description"
"2013115"	2021-11-04	"Dr Simranpreet Kaur"	"Ideas Grants"	"Ideas Grants"	"Accelerating treatment for epilepsy in children with KIF1A-associated neurological disorders."	"Murdoch Childrens Research Institute"	"VIC"	"Research Institutes"	776019.5	"Basic Science"	"neurosciences | neurology and neuromuscular diseases | genetics | neurogenetics | neurosciences | central nervous system |"	"neurological diseases"	"seizures"	"genetic disorders"	"brain development"	"neurodegenerative disorders"	"Epilepsies are life threatening, where approximately 40% patients do not respond to current medications. Mutations in the KIF1A gene lead to a devastating form of epilepsy where patients die within first 5 years of life. We will use extremely innovative and physiologically relevant models such as stem cells and bioinformatic algorithms to identify novel therapies for KIF1A-related epilepsies."
"2013129"	2021-11-04	"Prof Thomas Riley"	"Ideas Grants"	"Ideas Grants"	"A One Health/System Dynamics approach to reducing Clostridioides difficile infection"	"University of Western Australia"	"WA"	"University"	1284890.5	"Public Health"	"public health and health services | environmental and occupational health and safety | clinical sciences | infectious diseases | medical microbiology | medical infection agents (incl. prions) |"	"antimicrobial resistance"	"disease transmission"	"public health impact"	"molecular epidemiology"	"zoonoses"	"Clostridioides difficile infection is a major public health problem. While thought to be acquired in hospitals, evidence is growing that it can be acquired in the community. The bacteria have been found in food, households, farm animals and the environment, but we don’t understand what role this plays in human infection. We will use a novel approach using systems modelling to understand how people become exposed to C. difficile and, most importantly, what we can do to control the infection."
"2013158"	2021-11-04	"Assoc Prof Brian Drew"	"Ideas Grants"	"Ideas Grants"	"Polygenic mitochondrial dysfunction in heart failure and neurodegeneration"	"Baker Heart and Diabetes Institute"	"VIC"	"Research Institutes"	1166807	"Basic Science"	"medical biochemistry and metabolomics | metabolic medicine |"	"mitochondrial function"	"heart failure"	"population genetics"	"neurodegeneration"	"ageing"	"Mitochondria are the energy producing components of our cells. Genetics influences mitochondrial function, which influences risk for diseases such as heart failure and neurodegeneration. We don’t yet fully understand this genetic influence, however we propose that subtle, cumulative genetic (polygenic) differences may be liable. We will test this idea using unique mouse models, and use these findings to identify readily detectable measures for developing heart failure and neurodegeneration."
"2013180"	2021-11-04	"Dr Guillermo Gomez"	"Ideas Grants"	"Ideas Grants"	"Harnessing artificial intelligence, spatial-omics and patient-derived organoids to cure glioblastoma."	"University of South Australia"	"SA"	"University"	1999371	"Basic Science"	"biochemistry and cell biology | biochemistry and cell biology not elsewhere classified |"	"metabolic stress"	"cell adhesion"	"microenvironment"	"glioblastoma"	"artificial neural networks"	"This Proposal will investigate the mechanisms by which tumour cells reprogram healthy non-cancerous cells to support the tumour cells’ energy demands. Our results will lay the foundations of new anti-cancer approaches that will not only inhibit tumour cell source of energy (metabolism) but also prevent their metabolic compensation via recruitment and reprogramming of surrounding healthy cells."
"2013189"	2021-11-04	"Dr Richard Mills"	"Ideas Grants"	"Ideas Grants"	"Bioengineered skeletal muscle to discover therapies for age-related muscle weakness"	"QIMR Berghofer Medical Research Institute"	"QLD"	"Research Institutes"	950516	"Basic Science"	"medical biotechnology | regenerative medicine (incl. stem cells and tissue engineering) |"	"skeletal muscle"	"sarcopenia"	"exercise"	"skeletal muscle wasting"	"epigenetics"	"As we grow older the positive effects of exercise training in muscle are reduced. This project will use 1000s of lab made mini-muscles, which act and function like real human skeletal muscle to understand changes that occur when we get older and how muscle responds to training. By understanding these changes we aim to identify new therapies to treat age-related muscle weakness, so that every Australian can be active and healthy in their older years."
"2013215"	2021-11-04	"Dr David Jacques"	"Ideas Grants"	"Ideas Grants"	"Understanding how viruses overcome the nuclear pore complex, the gatekeeper of genomic access"	"University of New South Wales"	"NSW"	"University"	794379	"Basic Science"	"biochemistry and cell biology | protein trafficking |"	"human immunodeficiency virus (hiv)"	"nuclear transport"	"encapsidation"	"viral proteins"	"antiviral agents"	"HIV remains an incurable disease. New ways of treating HIV infection are needed if we are to be ready for emerging strains that are resistant to current treatments. The viral shell, the ‘capsid’, has proven to be a good target for new drugs. We aim to understand how the capsid tricks immune cells into allowing HIV to enter their nuclei where it establishes infection. Understanding how HIV enters the nucleus will not only inform HIV therapies but also virus-inspired gene therapy technologies."
"2013237"	2021-11-04	"Assoc Prof Yeesim Khew-Goodall"	"Ideas Grants"	"Ideas Grants"	"Overcoming chemoresistance in triple negative breast cancer"	"University of South Australia"	"SA"	"University"	1121242	"Basic Science"	"biochemistry and cell biology | signal transduction |"	"protein kinase c (pkc)"	"protein phosphorylation"	"molecular modelling"	"breast cancer"	"chemotherapy"	"Triple negative breast cancer (TNBC) is the most challenging breast cancer to treat. There is no reliable targeted therapy available and chemotherapy is the standard of care. About 20-25% of patients will become chemoresistant. For these patients, there are few viable treatment options available and their median survival is about 12 months. In this study, we aim to better understand the pathways to chemoresistance and to use a novel paradigm to develop new drugs to circumvent chemoresistance."
"2013243"	2021-11-04	"Prof Zane Andrews"	"Ideas Grants"	"Ideas Grants"	"Top down cortical control of hypothalamic feeding circuits"	"Monash University"	"VIC"	"University"	895804	"Basic Science"	"neurosciences | central nervous system | medical physiology | systems physiology | neurosciences | neurosciences not elsewhere classified |"	"appetite regulation"	"neural pathways"	"feeding disorders"	"acute stress"	"motivation"	"Obesity continues to be a significant burden to public health shows no sign of slowing. A central part of the problem is the overconsumption calorically dense, highly palatable and innately rewarding foods. Although genetic evidence shows this overconsumption is driven by our brain, the precise way this occurs remain unknown. In this proposal, we will assess how the brain cortex communicates with the hypothalamus in order to control food intake, food motivation and the development of obesity."
"2013260"	2021-11-04	"Prof Kerry-Anne Rye"	"Ideas Grants"	"Ideas Grants"	"A novel, dual-targeted therapeutic approach for reducing diabetes-accelerated atherosclerosis"	"University of New South Wales"	"NSW"	"University"	1566077	"Basic Science"	"cardiorespiratory medicine and heamatology | cardiology (incl. cardiovascular diseases) |"	"atherosclerosis"	"type 2 diabetes mellitus (non-insulin dependent diabetes mellitus)"	"inflammation"	"myeloperoxidase"	"peptides"	"Patients with diabetes are in a pro-inflammatory state and many of them develop an aggressive form of heart disease. Blood levels of the pro-inflammatory enzyme myeloperoxidase (MPO) are also elevated in these patients. This project will determine whether treatment with peptides that have anti-diabetic and anti-inflammatory properties plus an MPO inhibitor reduces heart disease in these patients more effectively than the peptides alone or an MPO inhibitor alone."
"2013278"	2021-11-04	"Dr Andrew Philp"	"Ideas Grants"	"Ideas Grants"	"Enhancing mitochondrial energetics to prevent age-associated muscle weakness"	"University of New South Wales"	"NSW"	"University"	799706	"Basic Science"	"biochemistry and cell biology | cell metabolism |"	"skeletal muscle"	"skeletal muscle wasting"	"mitochondria"	"clinical pharmacology"	"ageing"	"Sarcopenia is a recognized disease of ageing, describing the progressive decline in skeletal muscle mass and strength that occurs from midlife in humans. Recent research suggests that a decline in mitochondrial function, the energy producing cells in our body, precedes the development of sarcopenia. This project will test whether increasing mitochondrial energetics in skeletal muscle with the pharmacological compound BAM15 can prevent sarcopenia in mouse and human models of ageing."
"2013281"	2021-11-04	"Dr Jacob Gratten"	"Ideas Grants"	"Ideas Grants"	"Understanding the pathophysiology of Parkinson’s disease using cellular genomics"	"University of Queensland"	"QLD"	"University"	837064	"Basic Science"	"genetics | gene expression (incl. microarray and other genome-wide approaches) | genetics | quantitative genetics (incl. disease and trait mapping genetics) | genetics | neurogenetics |"	"parkinson disease"	"gene expression"	"genetic association"	"complex genetic disease"	"neurogenetics"	"Parkinson’s disease (PD) is a devastating neurodegenerative condition affecting 1% of Australians aged 60-years and over. Understanding the genetic basis of PD is critical to identifying new drug targets. We will apply powerful methods for measuring gene expression in single cells to identify specific genes that are altered in specific cell types in PD-related brain and gut regions. Our study will shed light on the cell type-specific molecular pathology of PD."
"2013284"	2021-11-04	"Assoc Prof Craig Harrison"	"Ideas Grants"	"Ideas Grants"	"Transforming fertility treatment"	"Monash University"	"VIC"	"University"	846531.5	"Basic Science"	"paediatrics and reproductive medicine | reproduction |"	"ovary"	"female infertility"	"growth factor therapy"	"protein engineering"	"activin and inhibin"	"It is estimated that worldwide 186 million individuals live with infertility. Depending on the cause of infertility, treatment ranges from medications to stimulate ovulation through to more complex procedures, such as in vitro fertilisation (IVF). These fertility treatments have been quite successful; however, they all rely on decades-old medications that promote or suppress hormone activity. We will develop a new set of drugs that target ovarian growth factors to treat or prevent infertility."
"2013285"	2021-11-04	"Prof Gary Housley"	"Ideas Grants"	"Ideas Grants"	"Bionic-array Directed Gene Electrotransfer for Treating Focal Brain Disorders"	"University of New South Wales"	"NSW"	"University"	1941007.2	"Basic Science"	"biomedical engineering | biomedical instrumentation | neurosciences | central nervous system |"	"biomedical engineering"	"gene delivery"	"gene therapy"	"focal epilepsy"	"neurological disorders"	"A platform for localized brain gene therapy, ‘Brain-BaDGE’, will be developed from proprietary UNSW electric field-focusing technology. This translational program will produce a first-for-human ‘needle-like’ medical device for electrotransfer of therapeutic DNA encoding a neuromodulator targeted to groups of neurons in the brain to suppress epileptic seizures of focal origin. This Brain-BaDGE platform will establish a translational pathway for gene therapies treating localized brain disorders."
"2013305"	2021-11-04	"Dr Jan Kaslin"	"Ideas Grants"	"Ideas Grants"	"Precursor neurons on standby fast track neural repair"	"Monash University"	"VIC"	"University"	814423	"Basic Science"	"genetics | developmental genetics (incl. sex determination) | neurosciences | cellular nervous system | biochemistry and cell biology | cell development, proliferation and death |"	"neurodevelopment"	"adult neurogenesis"	"zebrafish"	"neural regeneration"	"acute inflammation"	"Brain and spinal cord injury are devastating events that has a life-long impact on the patient’s life with wide-reaching social and economic effects. This research program uses innovative regeneration models and screening approaches to identify how endogenous cells and molecules can be hoaxed to boost neural regeneration after injury or in disease. The work provides critical insight and hold keys to unlocking strategies for future restorative therapies in the brain or spinal cord."
"2013323"	2021-11-04	"Prof Louisa Jorm"	"Ideas Grants"	"Ideas Grants"	"Hospital trajectories for 15 million Australians"	"University of New South Wales"	"NSW"	"University"	655934.6	"Health Services Research"	"public health and health services | health information systems (incl. surveillance) | public health and health services | epidemiology | statistics | applied statistics |"	"data analysis"	"applied statistics"	"hospitalisation"	"longitudinal study"	"health service utilisation"	"Patient segmentation, which divides a patient population into distinct groups with specific needs and characteristics, underpins a patient-centred approach to health care. We will use hospital records for the population of NSW and deep learning to identify clusters (segments) of patients who share patterns of hospital use, characterise and visualise these, and explore how they change over time. Our novel methods will have application in health service planning and delivery and research."
"2013349"	2021-11-04	"Dr Rodrigo Suarez"	"Ideas Grants"	"Ideas Grants"	"Building the mind: interplay of transcriptional and electrical activities in the self-assembly of cortical circuits in vivo"	"University of Queensland"	"QLD"	"University"	887243.2	"Basic Science"	"neurosciences | central nervous system |"	"early brain development"	"cerebral cortex"	"transcriptional regulation"	"neural coding"	"targeted gene delivery"	"The early impact of nature and nurture influences in human brain wiring remains poorly understood due to a lack of ways to study embryonic development in naturalistic live models. We have established advanced new methods in an Australian marsupial that allow, for the first time, mechanistic studies of how genes and electrical activity interact to form precise circuits in the cerebral cortex. These unique opportunities can revolutionise the way we understand brain wiring in health and disease."
"2013362"	2021-11-04	"Prof Rebecca Robker"	"Ideas Grants"	"Ideas Grants"	"Remodelling the ovary to extend female fertility and health"	"University of Adelaide"	"SA"	"University"	1449102.6	"Basic Science"	"paediatrics and reproductive medicine | reproduction |"	"ovary"	"ageing"	"fibrosis"	"extracellular matrix"	"monocyte/macrophage"	"Female infertility is commonly caused by an inability to release an egg from the ovary, particularly in women who are middle-age or if they have obesity or PCOS. We discovered that these females also have fibrosis in the ovary; excess collagen deposited by cellular stress and inflammation that prevents the egg from being released. This project will identify strategies to combat the detrimental changes in the ovary that cause fibrosis in order to improve female health."
"2013384"	2021-11-04	"Prof Paul Gleeson"	"Ideas Grants"	"Ideas Grants"	"Establishment of novel, neuronal-cell based, therapeutic screens for Alzheimer’s disease using patients stem cells"	"University of Melbourne"	"VIC"	"University"	861704.6	"Basic Science"	"biochemistry and cell biology | receptors and membrane biology |"	"stem cells"	"alzheimer disease"	"neurons"	"secretory pathway"	"golgi"	"Alzheimer’s disease is the most common cause of dementia and a major cause of death in Australia.  There is no effective treatment for this disease and there is an urgent need to develop treatments to target the cause of the Alzheimer’s disease.  This project aims to use human neurons derived from patient’s stem cells to establish a powerful screening platform for the identification of targeted therapeutic drugs to rescue neuron defects to efficiently treat Alzheimer’s disease."
"2013404"	2021-11-04	"Dr Andrew Currie"	"Ideas Grants"	"Ideas Grants"	"aSPOC – Commercialisable Aptamer-based Diagnostics for Sepsis Point of Care"	"Murdoch University"	"WA"	"University"	1043133.8	"Clinical Medicine and Science"	"medical biotechnology | medical biotechnology diagnostics (incl. biosensors) | clinical sciences | infectious diseases | clinical sciences | emergency medicine |"	"sepsis"	"biotechnology"	"diagnostic techniques"	"molecular basis of disease"	"biomarkers"	"Sepsis - bacterial blood infection - is a common cause of disease in babies and adults. Current diagnostic tests are too slow and often miss the sepsis diagnosis. We have identified blood markers that can improve sepsis diagnosis. Our team have developed a powerful system for making the molecular tools needed to rapidly detect these blood markers. We are working with science and manufacturing experts to make new sepsis tests that can be used easily by frontline staff in hospitals and GP clinics."
"2013421"	2021-11-04	"Prof Avril Robertson"	"Ideas Grants"	"Ideas Grants"	"Inhibiting ASC with small molecules for treatment of inflammatory diseases"	"University of Queensland"	"QLD"	"University"	1061883	"Basic Science"	"medicinal and biomolecular chemistry | biologically active molecules | immunology | innate immunity |"	"anti-inflammatory agents"	"airway inflammation"	"drug discovery"	"cell biology"	"viral immunology"	"During flu infection inflammation causes significant morbidity there is therefore a need to reduce this inflammation while tackling the viral infection, we have special molecules that have this dual action. We will develop these molecules so they can become future drugs and explore their use in flu models combined with either asthma or obesity as these people are particularly vulnerable to the deadly effects of flu."
"2013427"	2021-11-04	"Prof David Bishop"	"Ideas Grants"	"Ideas Grants"	"Do mitochondrial changes underlie insulin resistance induced by inadequate sleep, and can this be prevented by prescribed exercise?"	"Victoria University"	"VIC"	"University"	813502	"Basic Science"	"human movement and sports science | sports medicine |"	"mitochondria"	"exercise"	"sleep"	"muscle metabolism"	"exercise training"	"More than 7.4 million Australians suffer from inadequate sleep. Sleep loss doesn't just make us tired; we have shown it also negatively affects mitochondria (\"energy powerhouses\") and glucose metabolism (increasing the risk of diabetes). Based on compelling data, this project will discover novel mechanisms responsible for the negative effects of sleep loss and test targeted exercise prescription as a cost-effective strategy to prevent metabolic problems arising from inadequate sleep."
"2013451"	2021-11-04	"Prof Robyn Jamieson"	"Ideas Grants"	"Ideas Grants"	"ALPK1 dysfunction: revealing a novel pathogenic pathway in retinal diseases"	"University of Sydney"	"NSW"	"University"	747501.8	"Clinical Medicine and Science"	"ophthalmology and optometry | vision science |"	"retinal disease"	"photoreceptors"	"vision loss"	"ocular disease"	"blindness"	"Genetic retinal diseases are caused by changes in many different genes and lack effective therapy. This proposal aims to characterise and modulate a newly identified disease pathway in the retina. This holds promise for development of novel approaches to preserve vision in genetic and other forms of blinding retinal degeneration."
"2013460"	2021-11-04	"Prof Claudine Bonder"	"Ideas Grants"	"Ideas Grants"	"Exploiting a novel cell surface biomarker to defeat multiple myeloma"	"University of South Australia"	"SA"	"University"	908658	"Basic Science"	"oncology and carcinogenesis | cancer cell biology |"	"multiple myeloma"	"cancer prognosis"	"cell adhesion molecule"	"bone marrow stroma"	"inhibitors"	"Multiple myeloma is an incurable aggressive cancer of the bone marrow. In Australia, ~2,500 new cases are diagnosed every year with a 5 year survival rate of ~50% and treatment costs exceeding $700,000 per patient. We have identified a single cell surface protein to be upregulated by ~20% of myeloma patients who are then 3 times more likely to die within 6 years of diagnosis. This study examines a new prognostic tool to rapidly identify poor prognosis patients and new a target to treat them."
"2013468"	2021-11-04	"Dr Guillaume Méric"	"Ideas Grants"	"Ideas Grants"	"Understanding the asymptomatic carriage of pathogens and antimicrobial resistance (AMR) in the human gut microbiota"	"Baker Heart and Diabetes Institute"	"VIC"	"Research Institutes"	546216	"Basic Science"	"clinical sciences | infectious diseases | clinical sciences | clinical microbiology | biochemistry and cell biology | bioinformatics |"	"antimicrobial resistance"	"bioinformatics"	"microbiology"	"microbial ecology"	"microbial infections"	"The rise of microbial antibiotic resistance (AMR) and the lack of novel antibiotic compounds could soon be cancelling the effectiveness of current infectious disease therapies. Understanding and controlling the spread of AMR is a major challenge for public health, but we currently do not understand well if and how healthy people can carry and spread AMR genes. Here, we propose to study AMR dynamics in the gut microbiome of &gt;20,000 healthy people, linking it with health and prescription records."
"2013478"	2021-11-04	"Prof David Huang"	"Ideas Grants"	"Ideas Grants"	"Identifying rational approaches to enhance the activity of BH3 mimetic drugs in blood cancers"	"Walter and Eliza Hall Institute of Medical Research"	"VIC"	"Research Institutes"	992305.4	"Basic Science"	"oncology and carcinogenesis | haematological tumours |"	"bcl-2"	"leukaemia"	"lymphoma"	"apoptosis"	"therapeutic target"	"It is now appreciated that normal cell death prevents cancers from developing; however, this could be undermined in blood cancers (e.g., leukemias). This is often due to overactivity of BCL2 which allows the cancer cells to persist. Treating patients with a drug blocking BCL2 - venetoclax - is proving highly effective for such blood cancers. However, the disease will often eventually recur: this project seeks to understand why this is and to discover ways by which this can be prevented."
"2013500"	2021-11-04	"Assoc Prof Edwina McGlinn"	"Ideas Grants"	"Ideas Grants"	"MicroRNA targeting to enhance haematopoietic stem cell function"	"Monash University"	"VIC"	"University"	992474	"Basic Science"	"biochemistry and cell biology | cell development, proliferation and death | genetics | developmental genetics (incl. sex determination) |"	"mouse genetics"	"haematopoietic stem cells"	"microrna"	"stem cell biology"	"bone marrow transplantation"	"The ability to transplant blood stem cells has dramatically improved outcomes for many blood diseases. However, there is a major limitation in the numbers of appropriate blood stem cells available for use. We have identified a gene family that represses the potential of blood stem cells to function after transplantation. Here, we aim to inhibit this gene family to enhance blood stem cell function."
"2013511"	2021-11-04	"Assoc Prof Ozren Bogdanovic"	"Ideas Grants"	"Ideas Grants"	"The rogue germline: deciphering mechanisms of cancer testis antigen reactivation in cancer"	"University of New South Wales"	"NSW"	"University"	791930	"Basic Science"	"genetics | epigenetics (incl. genome methylation and epigenomics) |"	"epigenetics"	"germ cells"	"carcinogenesis"	"embryogenesis"	"genomics"	"Cancer testis antigens (CTAs) are proteins that are normally expressed in the germline of healthy individuals. During malignant transformation, CTAs become expressed in cancerous tissues, however their role in cancer formation is largely unknown. Given their tissue specificity, CTAs are being actively pursued as targets for cancer immunotherapy. This project aims to unravel the mechanisms of CTA reactivation and interrogate their contribution to cancer formation in vivo."
"2013538"	2021-11-04	"Prof Allison Pettit"	"Ideas Grants"	"Ideas Grants"	"Increasing hematopoietic stem cell niches post transplantation through enhancing bone marrow macrophage resilience and regeneration mechanisms"	"University of Queensland"	"QLD"	"University"	935616	"Basic Science"	"cardiorespiratory medicine and heamatology | haematology |"	"macrophages"	"haematopoietic stem cell transplantation"	"bone marrow reconstitution"	"tissue regeneration"	"bone marrow stroma"	"Bone marrow transplantation, a potential cure for blood cancers and used to enable high dose therapy in treatment resistant cancers, has a high-risk profile preventing treatment progression and high mortality. We will investigate a novel treatment to alleviate transplantation risk by improving the recovery of the recipient's bone marrow environment.  It is expected that the efficiency of donor stem cell engraftment will be increased, and reconstitution of blood and immune cells accelerated."
