"APP ID"	"Date Announced"	"CIA Name"	"Grant Type"	"Sub Type"	"Grant Title"	"Admin Institution"	"State"	"Sector"	"Total"	"Broad Research Area"	"Field of Research"	"Res KW1"	"Res KW2"	"Res KW3"	"Res KW4"	"Res KW5"	"Plain Description"
2003351	2020-12-15	"A/Pr Brad Sutherland"	"Ideas Grants"	"Ideas Grants"	"Harnessing the dual roles of pericytes to improve stroke outcomes"	"University of Tasmania"	"TAS"	"University"	853943	"Basic Science"	"Central Nervous System"	"ischaemic stroke"	"cerebral blood flow"	"reperfusion"	"neurovascular mechanism"	"transgenic mouse"	"Pericytes are cells that are in the walls of capillaries - the smallest blood vessels. Pericytes control blood flow and help promote recovery after injury. In stroke, pericytes squeeze the capillary shut, limiting the amount of energy getting to the brain. This proposal will use innovative techniques to understand how pericytes limit blood flow and also how we can utilise pericytes to improve brain recovery after stroke. This will allow us to identify new potential treatment options for stroke."
2003370	2020-12-15	"Prof Daniel Hoyer"	"Ideas Grants"	"Ideas Grants"	"Narcolepsy with cataplexy: a brain orexin replacement strategy"	"University of Melbourne"	"VIC"	"University"	810783.9	"Basic Science"	"Basic Pharmacology"	"sleep disorders"	"neuropharmacology"	"neurodegeneration"	"neuropeptides"	"ageing"	"Narcolepsy with cataplexy is a debilitating, life-long sleep-wake disorder, caused by the irreversible loss of the brain peptide 'orexin'. There is no satisfactory and safe treatment. We aim to develop an orexin analogue, delivered directly to the brain of sheep (relevant in size and translatable to patients) by a programmable pump to timely activate the orexin 'wake-up' switch. This innovative precision medicine project will significantly improve the quality of life of narcolepsy patients."
2003385	2020-12-15	"Prof Gene Tyson"	"Ideas Grants"	"Ideas Grants"	"Strain-level characterisation and visualisation of the mucosal microbial communities associated with Inflammatory Bowel Disease (IBD) for the development of novel biotherapeutics"	"Queensland University of Technology"	"QLD"	"University"	1181877.5	"Basic Science"	"Gastroenterology and Hepatology"	"inflammatory bowel disease (ibd)"	"microbial ecology"	"bioinformatics"	"fluorescent in situ hybridisation (fish)"	"molecular microbiology"	"Australia has one of the highest incidence rates in the world of Inflammatory Bowel Disease (IBD), a debilitating inflammatory condition of the gastrointestinal tract. Cutting-edge molecular and visualisation technologies will be used to examine the role of the gut microbiome in IBD, and identify specific members of this community to be used as new therapies to suppress inflammation and improve outcomes for patients with IBD."
2003392	2020-12-15	"Prof Stephen Wood"	"Ideas Grants"	"Ideas Grants"	"Predicting clozapine treatment response in psychotic illness"	"University of Melbourne"	"VIC"	"University"	721525.65	"Clinical Medicine and Science"	"Psychiatry (incl. Psychotherapy)"	"electroencephalogram (eeg)"	"clozapine"	"psychosis"	"glutamate"	"schizophrenia and related disorders"	"Not everyone with a psychotic illness gets better when treated with standard antipsychotic medication. We aim to better understand why some people need a different medicine (clozapine), and to develop methods that will let us identify those people early and monitor how effective the treatment is."
2003393	2020-12-15	"A/Pr Shireen Lamande"	"Ideas Grants"	"Ideas Grants"	"New therapeutic approaches for genetic skeletal disorders"	"Murdoch Childrens Research Institute"	"VIC"	"Research Institutes"	961150	"Basic Science"	"Biochemistry and Cell Biology not elsewhere classified"	"cartilage"	"bone"	"genetic disorders"	"pathogenic mechanisms"	"drug screening"	"Genetic skeletal disorders are a significant disease burden with limited therapeutic options. We will use mouse models of cartilage and bone disorders and human induced pluripotent stem cell derived bone and cartilage 'disease in a dish' models to test repurposed FDA-approved drugs and new drug candidates as novel therapeutic strategies."
2003395	2020-12-15	"Prof David Tscharke"	"Ideas Grants"	"Ideas Grants"	"Targeting miRNA biogenesis to treat herpes simplex virus latency"	"Australian National University"	"ACT"	"University"	800085.3	"Basic Science"	"Medical Virology"	"herpes simplex virus (hsv)"	"molecular virology"	"virology"	"microrna"	"neurovirology"	"Herpes simplex virus (HSV) causes cold sores in most infected people, but can also cause blindness and fatal brain infections. The biggest problem with HSV is that it never completely goes away - the virus hides in a part of the nervous system and can come out to cause disease over and over again. We have recently discovered a gene in people that the virus needs to maintain itself in this hidden state. In this project we will use this exciting discovery to work towards a cure for HSV."
2003401	2020-12-15	"Prof Assam El-Osta"	"Ideas Grants"	"Ideas Grants"	"Cytosine methylation predicts diabetic nephropathy progression"	"Monash University"	"VIC"	"University"	723825.5	"Basic Science"	"Nephrology and Urology"	"type 1 diabetes mellitus (insulin-dependent diabetes mellitus)"	"renal disease"	"kidney disease"	"epigenetics"	"gene transcription"	"Over 2 million Australians have diabetes and up to one in three adults will develop diabetes or pre-diabetes in their lifetime with the associated burden of complications. It is not simply genetics, as the genetic variability cannot explain why some individuals and indeed some families appear to be programmed to have an inordinate burden of complications. Over the last decade we have developed state of the art technologies to characterise epigenetic changes in human clinical cohorts."
2003414	2020-12-15	"A/Pr Timothy Bredy"	"Ideas Grants"	"Ideas Grants"	"Long noncoding RNA in space and time, and the regulation of fear extinction"	"University of Queensland"	"QLD"	"University"	1012244.6	"Basic Science"	"Cellular Nervous System"	"rna"	"synapse"	"memory"	"fear"	"epigenetics"	"Most of our genome is made up noncoding RNA; however, nothing is known about why a special class of noncoding RNA would be expressed in synapses, and how this affects learning and memory related to neuropsychiatric disorders. Understanding the fundamental molecular machinery underlying the formation of fear extinction memory will enable the development of new treatment approaches for anxiety-related disorders that are characterised by memory deficits."
2003416	2020-12-15	"Prof Anton Peleg"	"Ideas Grants"	"Ideas Grants"	"Virulence Associated small RNAs in Acinetobacter baumannii"	"Monash University"	"VIC"	"University"	964147.5	"Basic Science"	"Medical Bacteriology"	"bacterial pathogenesis"	"bacterial genetics"	"infectious diseases"	"antimicrobial resistance"	"bacterial virulence"	"This proposal aims to understand how a superbug that causes severe infections in hospitalised patients worldwide and is known to be resistant to almost all available antibiotics, causes disease. We then plan on using this information to guide the development of a new type of therapy to treat this severe infection."
2003435	2020-12-15	"Prof Michael Jennings"	"Ideas Grants"	"Ideas Grants"	"Structure and biophysical analysis aided design of novel toxoid vaccines for a major class of bacterial toxins."	"Griffith University"	"QLD"	"University"	608424.5	"Basic Science"	"Medical Bacteriology"	"bacterial toxins"	"streptococcal disease"	"group a streptococcal disease"	"pneumococcal disease"	"host/pathogen interaction"	"Inactivated bacterial toxins (toxoids), such as the tetanus vaccine, are safe and effective vaccines. Cholesterol dependent cytolysins (CDCs) are bacterial toxins produced by many important human pathogens including Group A Streptococcus (GAS) and Pneumococcus. GAS has no available vaccine and Pneumococcus does not have a universal vaccine. We have developed a new way of inactivating CDCs based on new knowledge of how they target human cells and will use this knowledge to make new vaccines."
2003446	2020-12-15	"Asst Prof David Collins"	"Ideas Grants"	"Ideas Grants"	"Simulating and stimulating the Blood-Brain-Barrier: a platform for investigating non-pharmaceutical Alzheimer's therapy"	"University of Melbourne"	"VIC"	"University"	680757.6	"Basic Science"	"Biomechanical Engineering"	"ultrasound"	"electrophysiology"	"blood-brain barrier"	"microenvironment"	"alzheimer disease"	"Alzheimer's disease is a looming public health threat worldwide. Despite the widespread acknowledgement of this issue, there are a lack of effective drugs that can slow disease progression. This project aims to investigate a new class of non-pharmaceutical treatment methods based on controlled acoustic, electrical and optical stimulation methods to treat and reverse the base causes of Alzheimer's disease."
2003507	2020-12-15	"Prof Jonathan Clark"	"Ideas Grants"	"Ideas Grants"	"Bionic Lid Implant for Natural Closure (BLINC)"	"University of Sydney"	"NSW"	"University"	378461.6	"Clinical Medicine and Science"	"Surgery"	"nerve injury"	"prosthesis"	"implant design"	"reconstructive surgery"	"eye disease"	"Facial paralysis results in loss of the ability to blink, which is the primary means of protecting and lubricating the eye. The eye becomes dry and ulcerated and eventually vision loss ensues. No therapy exists that can reliably restore blink and hence treatment is mostly palliative today. BLINC is an implantable device that artificially restores eye closure. It is wirelessly powered and readily implantable. BLINC has achieved eye closure similar to natural blinking in human cadaveric models."
2003537	2020-12-15	"Prof Belinda Gabbe"	"Ideas Grants"	"Ideas Grants"	"Predicting fracture outcomes from clinical Registry data using Artificial Intelligence Supplemented models for Evidence-informed treatment (PRAISE) study"	"Monash University"	"VIC"	"University"	636216.7	"Health Services Research"	"Orthopaedics"	"orthopaedic surgery"	"biostatistics"	"prediction"	"distal radial fractures"	"outcomes research"	"This project will establish the role of artificial intelligence (AI) techniques to improve the prediction of clinical and longer-term patient reported outcomes following wrist fracture. Prediction models based on existing, routinely collected registry data with will be compared with models based on registry data enhanced by AI analysis of X-ray images, radiology reports and surgical reports. The AI analysis will reason on both image and text data, better replicating how humans learn."
2003542	2020-12-15	"Dr Vihandha Wickramasinghe"	"Ideas Grants"	"Ideas Grants"	"Exploiting messenger RNA export as a novel therapeutic strategy to treat cancer"	"University of Melbourne"	"VIC"	"University"	948098	"Basic Science"	"Biochemistry and Cell Biology not elsewhere classified"	"rna"	"novel therapeutic agents"	"gene regulation"	"cancer prevention"	"rna processing"	"Novel therapies for cancers represent an area of unmet clinical need. We have identified a new biological pathway implicated in cancer, namely selective mRNA export. Compounds inhibiting other steps of the gene expression pathway are promising therapeutic candidates for cancer, yet mRNA export inhibitors do not exist. We propose to develop first-in-class inhibitors of mRNA export that selectively target transcriptionally addicted cancers with dysregulated RNA processing."
2003545	2020-12-15	"Dr Vihandha Wickramasinghe"	"Ideas Grants"	"Ideas Grants"	"Pathways that regulate nuclear export of circular RNA"	"University of Melbourne"	"VIC"	"University"	933327.2	"Basic Science"	"Gene Expression (incl. Microarray and other genome-wide approaches)"	"rna"	"gene regulation"	"nuclear transport"	"rna processing"	"rna binding proteins"	"An emerging and unusual class of RNA molecules, circular RNAs (circRNAs), is widespread and plays important roles in cancer initiation and progression. However, the pathways responsible for nuclear export of circRNAs are unknown. We propose here to systematically determine how circRNAs are exported from the nucleus and characterise the effect of modulating circRNA export pathways in cancer. This will enable us to determine whether circRNAs can function as a biomarker of patient response."
2003561	2020-12-15	"Dr Alysha Elliott"	"Ideas Grants"	"Ideas Grants"	"Antibiotic potentiators as an alternative therapeutic option for the treatment of extensively drug-resistant Gram-negative infections"	"University of Queensland"	"QLD"	"University"	856857.5	"Basic Science"	"Biologically Active Molecules"	"antibiotics"	"antibiotic resistance"	"antibiotic therapy"	"combination therapy"	"microbial infections"	"Antibiotic mono-therapies are increasingly ineffective for hard-to-treat bacterial infections, forcing clinicians to rely on combinations of antibiotics. Our project has identified compounds that have weak to no antimicrobial potency in their own right, yet when combined with an existing antibiotic they potentiate its activity and restore its ability to treat resistant infections. These antibiotic potentiators are exciting alternatives to current therapies with reduced risk of induced resistance"
2003575	2020-12-15	"Dr Megan Bywater"	"Ideas Grants"	"Ideas Grants"	"Oncogenic determinants of the immune response in acute myeloid leukaemia"	"QIMR Berghofer Medical Research Institute"	"QLD"	"Research Institutes"	588143.7	"Basic Science"	"Tumour Immunology"	"acute myeloid leukaemia (aml)"	"oncogenes"	"cancer immunology"	"cancer immunotherapy"	"mouse models"	"There is an urgent need to develop new therapies for patients with AML. We have shown that the body's own immune system can target certain types of AML. We will determine how these types of AML change to escape control from the immune system and how this can be reversed to re-engage the anti-AML immune response. Using patient samples, we will determine how the anti-AML immune response changes during the course of standard therapy in order to best combine it with immune-targeted therapies."
2003595	2020-12-15	"Prof Sean Drummond"	"Ideas Grants"	"Ideas Grants"	"Identifying a modifiable risk factor for PTSD: insomnia-related disruption of trauma recovery mechanisms"	"Monash University"	"VIC"	"University"	1072992.95	"Clinical Medicine and Science"	"Biological Psychology (Neuropsychology, Psychopharmacology, Physiological Psychology)"	"insomnia"	"rapid eye movement (rem) sleep"	"extinction"	"posttraumatic stress disorder (ptsd)"	"fear"	"About 4.6 million Australians will experience PTSD during their life. Having insomnia before or immediately after trauma exposure makes it 2.5-3 times more likely someone will develop PTSD, but no one knows why. This project will, for the first time, propose and test a reason why insomnia increases the risk of PTSD. If successful, we will identify one of the few risk factors that can actually be modified in order to reduce the likelihood of developing PTSD after a trauma."
2003599	2020-12-15	"Prof Roger Daly"	"Ideas Grants"	"Ideas Grants"	"A novel, actionable pathway promoting metastasis of triple negative breast cancer"	"Monash University"	"VIC"	"University"	708272	"Basic Science"	"Cancer Cell Biology"	"breast cancer"	"protein kinases"	"targeted therapy"	"metastases"	"cell signalling"	"Triple negative breast cancer (TNBC) is particularly aggressive and lacks targeted therapies, limiting treatment to chemotherapy. A protein termed PEAK1 drives TNBC but has remained 'undruggable'. Recently, we identified an enzyme, termed CAMK2D, that acts downstream of PEAK1 and mediates its effects. In this grant we will characterize the mechanism of CAMK2D and determine the effect of a drug that blocks its action. This may lead to a new targeted and personalized treatment for TNBC."
2003606	2020-12-15	"Prof Daniel Green"	"Ideas Grants"	"Ideas Grants"	"Identifying the Optimal Age to Apply Physical Activity Interventions to Improve Heart Health"	"University of Western Australia"	"WA"	"University"	852804.2	"Public Health"	"Exercise Physiology"	"physical activity"	"exercise physiology"	"early intervention"	"heart development"	"public health"	"By performing sophisticated, novel and sensitive measurements on the heart at age 30 and linking these to richly characterised historical data, we will determine whether there is an optimal age to apply physical activity interventions to improve adult heart health. This is possible using data collected from 18 weeks pregnancy through to adulthood in ~3,000 Australians. This study will inform policy and interventions to reduce heart disease; the single biggest cause of mortality in Australia."
2003629	2020-12-15	"Dr Benjamin Mullin"	"Ideas Grants"	"Ideas Grants"	"Analysis of the osteoclast methylome for characterisation of epigenetic mechanisms underlying metabolic bone disease"	"University of Western Australia"	"WA"	"University"	299018	"Basic Science"	"Epigenetics (incl. Genome Methylation and Epigenomics)"	"dna methylation"	"gene expression"	"osteoporosis"	"osteoclast"	"epigenetics"	"A large number of genetic variants have been identified that have a role in osteoporosis, however for many of these, the mechanism by which they influence the disease remains to be determined. This study will fill a critical knowledge gap by investigating the epigenetic control of gene expression in osteoclasts (bone resorbing cells). This research will generate a unique international resource that will provide foundation data to understand and treat this prevalent and debilitating bone disease."
2003636	2020-12-15	"Prof Jade Forwood"	"Ideas Grants"	"Ideas Grants"	"Understanding novel viral host interactions that modulate innate immunity"	"Charles Sturt University"	"NSW"	"University"	764246	"Basic Science"	"Innate Immunity"	"virology"	"structural biology"	"innate immunity"	"dengue"	"x-ray crystallography"	"Lethal viruses such as coronaviruses (MERS, SARS-CoV-1, SARS-CoV-2), Dengue, Zika, Hendra, and Nipah have developed effective mechanisms of replication by dampening the host immune system. Here we will examine how viruses carry out these immune evasion functions, and test antiviral drugs that can prevent these effects in a highly specific manner. If this idea can be proved, it will provide great promise for the development of new antivirals whilst minimising the toxic effects to the cell."
2003646	2020-12-15	"Dr Christina Mo"	"Ideas Grants"	"Ideas Grants"	"Elucidating the role of transthalamic pathways in cortical processing"	"University of Melbourne"	"VIC"	"University"	792688	"Basic Science"	"Sensory Systems"	"neural pathways"	"thalamus"	"cerebral cortex"	"sensory systems"	"schizophrenia"	"Your brain senses the world and produces a suitable motor response by processing information between brain regions, such as primary sensory cortex to secondary cortex. Surprisingly, cortical pathways have a parallel route through the thalamus (transthalamic pathways) but their function is entirely unknown. We will use novel genetic and viral tools to shut down neural pathways while mice make decisions, thus identifying new circuits in our understanding of disorders with cognitive deficits."
2003662	2020-12-15	"A/Pr Tri Phan"	"Ideas Grants"	"Ideas Grants"	"Bring out your dead - how does defective apoptotic cell clearance by tingible body macrophages lead to the activation of self-reactive B cells in SLE?"	"University of New South Wales"	"NSW"	"University"	721596.5	"Basic Science"	"Autoimmunity"	"b cells"	"germinal centre"	"macrophages"	"autoantibodies"	"autoimmune disease"	"Good housekeeping is critical to the day-to-day running of the immune system. In the case of the germinal centre, a key structure where plasma cells are generated, the ability to clear away dead and dying cells is critical because failure to do so can lead to the spillover of cellular waste and debris into the follicle where they can activate harmful B cells to make autoantibodies and cause disease. Understanding how this happens can lead to new ways to target and treat autoimmune diseases."
2003683	2020-12-15	"A/Pr Jillian Carr"	"Ideas Grants"	"Ideas Grants"	"Modulating COVID-19 disease by targeting virus and virus-induced responses through pharmaceutical and mechanical ventilation strategies: SARS-CoV-2 S-protein, ACE2 and TMPRSS2"	"Flinders University"	"SA"	"University"	628856	"Clinical Medicine and Science"	"Medical Virology"	"sars-cov-2"	"covid-19"	"acute respiratory distress syndrome (ards)"	"acute lung injury"	"androgen receptor gene expression"	"COVID-19 is a current global pandemic that is likely to be an on-going threat. We need a multipronged strategy to combat COVID-19, including therapeutic anti-virals and clinical practice management strategy. We will address both these points to define the mechanisms triggering disease, test existing drugs targeting androgens and modify the way doctors use ventilators to treat COVID-19 disease in the intensive care unit. Outcomes will have impact beyond COVID-19 for managing viral lung disease."
2003686	2020-12-15	"Dr Vincent Laurent"	"Ideas Grants"	"Ideas Grants"	"Examining the metabolic and cognitive deficits caused by insulin resistance in the ventral striatum"	"University of New South Wales"	"NSW"	"University"	400372	"Basic Science"	"Biological Psychology (Neuropsychology, Psychopharmacology, Physiological Psychology)"	"behaviour"	"decision making"	"insulin action"	"striatum"	"conditioning"	"Brain insulin resistance is thought to cause metabolic and cognitive deficits, but the underlying neural mechanisms remain elusive. This project addresses this gap in our knowledge by examining how brain insulin resistance disrupts the metabolic regulation of food intake and the cognitive control of actions. The outcomes will provide new insights in disorders characterised by brain insulin resistance such as obesity and dementia."
2003688	2020-12-15	"Prof Katryn Stacey"	"Ideas Grants"	"Ideas Grants"	"Mammalian \"endotoxin\": Characterisation of highly inflammatory endogenous material"	"University of Queensland"	"QLD"	"University"	915859	"Basic Science"	"Innate Immunity"	"toll-like receptors"	"inflammation"	"innate immunity"	"oxidative stress"	"lipid oxidation"	"Inflammation drives development of many common diseases including heart disease, cancer, Alzheimer's disease and diabetes. We understand how bacterial molecules initiate inflammation during infections, but the nature of inflammatory stimuli that promote degenerative diseases of ageing has been elusive. In this project we will identify highly inflammatory molecules that have become altered in cells under stress. Knowledge of these pathways will promote new treatments for chronic diseases."
2003693	2020-12-15	"Dr Thierry Jarde"	"Ideas Grants"	"Ideas Grants"	"Characterising the function of niche-derived Neuregulin 1 in colorectal cancer"	"Monash University"	"VIC"	"University"	994246	"Basic Science"	"Cancer Cell Biology"	"adult stem cells"	"neuregulin"	"stromal cells"	"colorectal cancer"	"cellular interactions"	"Colorectal cancer affects thousands of Australians each year. A specialised cell population, named cancer stem cells, continuously produces new tumour cells. Defining mechanisms controlling the behaviour of these unique cells is critical to develop new drugs. We have identified that Neuregulin-1 is a key factor that enhances the action of cancer stem cells. We aim to study how colorectal cancer is mediated and whether targeting Neuregulin-1 is a promising therapeutic option."
2003710	2020-12-15	"Dr Sarah Gordon"	"Ideas Grants"	"Ideas Grants"	"Creating a phenotypic catalogue of synaptic vesicle cycling disorders"	"University of Melbourne"	"VIC"	"University"	876975.4	"Basic Science"	"Cellular Nervous System"	"neurodevelopmental disorders"	"synaptic vesicles"	"neurotransmission"	"exocytosis"	"endocytosis"	"Developmental disorders affect 2-5% of children. In order to understand how these mutations will likely affect neurological function in these individuals, and to develop a tailored care and treatment program, we must first understand how these mutations affect neuronal communication. This research program will identify the underlying cause of neurological dysfunction in a subset of these disorders (synaptic vesicle cycle disorders), affecting 1200-3000 children in Australia alone."
2003712	2020-12-15	"Dr Danny Wilson"	"Ideas Grants"	"Ideas Grants"	"Host-directed therapy for malaria: host cell signalome as a target"	"University of Adelaide"	"SA"	"University"	898043.2	"Basic Science"	"Medical Parasitology"	"malaria"	"plasmodium"	"antimalarial"	"host/pathogen interaction"	"kinase inhibitors"	"Malaria parasites kill 450,000 children a year and impact on the economic development of communities. Spreading drug resistant malaria parasites within Australia's South-East Asian neighbours creates an urgent and unmet need for new drug treatments. We will characterise host signals required for parasite survival in immature erythrocytes and identify host-directed, ready to develop, resistance-proofed drugs to kill malaria parasites."
2003752	2020-12-15	"Prof Grant Drummond"	"Ideas Grants"	"Ideas Grants"	"Targeting the NLRP3 inflammasome and interleukin-18 in hypertensive heart failure"	"La Trobe University"	"VIC"	"University"	1241115	"Basic Science"	"Basic Pharmacology"	"cardiac hypertrophy"	"cardiac fibrosis"	"cardiac dysfunction"	"hypertension"	"immunotherapy"	"Heart failure is a common complication of hypertension and a major cause of death and disability worldwide. This project will characterise a newly identified inflammatory pathway that we believe to be a major cause of the enlargement and scarring of the heart that accompanies hypertension. We will also trial drugs that block this inflammatory pathway to determine their suitability as future therapies for this devastating disease."
